url	title	body	keywords
https://neurococi.ro/posts/Scoala-de-Politie-Campina-a-publicat-flo/	Şcoala de Poliţie Câmpina a publicat floppydisk-ul conţinând toate cursurile instituţiei.	      Pentru că anul acesta cursurile se vor desfăşura online, şcoala de poliţie a pregătit câte un floppydisk pentru fiecare viitor poliţist, acesta conţinând tot ceea ce este necesar pentru exercitarea meseriei: 9 poze, 2 teste grilă şi simulatorul de luptă cu mafia: Mario & Luigi. Directorul şcolii, generalul Mache Vasile, relatează: 'Pandemia ne-a forţat să privim spre viitor. Nu mai e ca pe vremea mea, când eram obligaţi să participăm la cursuri cu caiet in care să scriem de 100 de ori 'Să trăiţi domnu' Duduianu!'. Ne-am modernizat! Păcat numa' că anu viitor împlinesc 38 de ani şi ies la pensie, că pe floppy mai era spaţiu căcălău şi-am băgat şi tetris .'   	politie, campina, online, scoala, floppy, mario, duduianu, clan, interlopi
https://neurococi.ro/posts/Fenomen-ingrijorator-Tot-mai-multi-barba	Fenomen îngrijorător. Tot mai mulţi bărbaţi fac imprudenţa să plece prea devreme din localuri lăsându-şi îngerii păzitori la masă.	      Patronul unui bar din Hunedoara ne relatează: ' ..îi sună nevasta şi pleacă imediat ca fraierii fară să se gândească la ce riscuri se expun, şi asta pentru că îngerii lor păzitori, majoritatea de sex masculin şi necăsătoriţi, nici nu se găndesc să plece până nu se închide localul. Dimineaţa la închidere de-abia îi convingem să-şi ia zboru', şi asta după ce-şi sparg aura de masă şi ne ameninţă că ne taie dacă nu le mai dăm de băut. Pentru noi nu e prea mişto, că ăştia plătesc cu Revolut şi nici nu se gândesc să lase ciubuc. Plus că la plecare zboară toţi în jurul neonului de la ieşire şi trebuie să măturăm 2-3 metri cubi de pene.'   	hunedoara, bar, ingeri, pazitor, barbati
https://neurococi.ro/posts/Noutate-la-CES-2020-robotul-care-jefuies/	Noutate la CES 2020: robotul care jefuieşte roboţi ce cară bagaje.	      La numai un an de la lansarea robotului care îţi cară bagajele, o companie înregistrată în România a lansat gama de roboţi Mangless v1.0. Aceştia sunt complet autonomi, dotaţi cu inteligenţă artificială, texte de diversiune şi arme albe. Odată lăsaţi liberi prin oraş localizează roboţii mai fraieri care cară bagaje şi prin diverse metode îi lasă în cipu' gol. CEO-ul companiei, domnul Fane Elvis, prezintă invenţia: 'Văr-mio, Pardalian, a fost prezent anu' trecut la CES să strângă neşte portofele că ne făcurăm firmă dă roboţ da' n-aveam clenţi că cică n-aveam portofeliu mâncaţ-aş p*la lu' matale. Pardalian o venit acasă cu fo 40 dă portofele da' mai ales cu o veste pe care o haşteptam de mult: fraerii la planetă au inventat bagaju' care vine singur dupe tine! No, păi am luat un IT-ist de la Cluj că era simpatic şi ştia să poarte barbă şi să ne facă cafele, şi ne-am pus serios pă trabă. Ne-am strâns toţ la un brainstorming să scoatem ce-avem mai bun din cap: Frati-miu, Napoleon, s-a gândit că fiecare robot să poarte în tolbă bastonu' de baseball. Nevastă-sa, Marchiza, a scos decât un muc dar mare cât o minge de pimpong..asta o s-o folosim la 'Behind the Scenes'...şi tot aşa până când result frameworkul a mulţumit clanu' de stakeholderi respectând standardele de meta-evaluare. First Approach a robotului Mangless este una non-violentă în care 2 roboţ care comunică prin NFC găsesc un mâner de haur chiar în faţa robotului naiv, oferindu-i acestuia mâneru' pe conţinutul bagajului. Dacă robotu' papagal nu pune botu' la diversiune atunci Mangless, cu gesturi rapide, îi mai face neşte buzunare iar partenerul său recuperează repede stomacul naivului. Curat, ca-n vremurile bune, când sperai că părul din conservele Scandia Sibiu e de porc.'   	robot, mangless, proiect, ces, bagaje, scandia, tigani, inteligenta artificiala, portofele
https://neurococi.ro/posts/Masina-timpului-inventata-de-un-roman-ca/	Maşina timpului inventată de un român care nu vrea să înveţe.	      Un student care stă de 3 ani în anul II la UPT, după ce a epuizat fara succes toate metodele clasice de copiat, a realizat prima maşină a timpului complet funcţională, pentru a putea termina facultatea. 'În primul an a mai mers, mi-am făcut propria retea GSM şi un penar în banda de 710MHz care comunica cu pixu prin NFC şi reuşeam să fentez dispozitivele de bruiat ale profilor. Din anul II nu a mai mers. Testele sunt mai lungi decât cele din anul I şi mi se termină pixu'. Am fost nevoit să fac o maşina a timpului din ce am găsit prin sala de lectură de la etajul 2: o chiuvetă spartă, 1 borcan de zacuscă din 1994, 3 prezervative şi-o diodă. Acum e simplu, cu o săptămână înainte mă sui în maşină şi dau o tură pe la sala de examene să văd subiectele. Profii încă n-au observat ca eu stau în 2 rânduri: într-unul scriu de zor, iar în celălalt stau cu o chiuvetă spartă pe masă. Bine că am reuşit că nu ştiu cum aş fi putut învăţa atâtea tâmpenii.'   	upt, student, masina timpului, examene
https://neurococi.ro/posts/Mii-de-vedete-vazute-in-Romania-La-o-sin/	Mii de vedete văzute în România! La o singură terasă au stat ieri 5 Chuck Norris.	      Dovada clară o constituie listele cu clienţi ţinute de barurile care respectă Părerea Guvernului publicată vineri în Monitorul Oficial sub nr 394/2020. Ospătarul localului în care ieri seară au băut câte 16 beri domnii Chuck Norris, povesteşte: 'Aştept de mult să intre în local ceva vedete că am auzit că ăştia lasă ciubuc serios. Pe dracu'! N-au lăsat absolut nimic, aşa că am fost nevoit să le trag câte-un şut în cur la plecare. Pe unu' l-am şi ţinut până dimineaţa la spălat pahare de m-a sunat doamna Norris că-l dăduse Missing in Action.'   	terase, 394, guvern, chuck, liste, clienti, beri
https://neurococi.ro/posts/Iohannis-a-fost-cooptat-in-trupa-Dead-So/	Iohannis a fost cooptat în trupa Dead South.	      Nate Hilts, lead volcals la Dead South, într-un interviu acordat revistei Billboard, face următoarele precizări: 'Noi mai tragem piese pe-afară sau live pe la concerte şi laboratoarele Dolby nu au adus încă pe piaţă un produs care să înlăture corespunzător zgomotul de fond în astfel de situaţii. Am auzit de băiatu' ăsta din România care e un fenomen! Adio zgomot de fond!..Unde apare el ţi se-nfundă urechile! Partea nasoală e că tre' să fii pe fază..uite săptămâna trecută filmam o piesă pe calea ferată şi, dacă nu se intrerupea puţin Dopey din tăcut, ne lovea trenul care venea în mare viteză, fluierând continuu. Da, aţi ghicit, numele de scenă e Dopey, că Iohannis sună ca p*la. Unii zic că nu i se potriveşte că nu e pitic...e drept, dar noi zicem că e mai mult mutulică decât înalt! Avem noroc că e şi liber, nu trebuie să semneze condica pe undeva, aşa că putem să-l luăm cu noi peste tot.'   	iohannis, dolby, dead south, mutulica, dopey, rock, band
https://neurococi.ro/posts/Un-start-up-romanesc-lanseaza-sprayul-cu	Un start-up românesc lansează sprayul cu bani.	      Notă: Puteţi naviga înapoi la pornache pentru că acest articol are un singur adresant: Ion Ţiriac. Start-up-ul a fost gândit să deservească o piaţă foarte mică, practic numai pe Ţiriac. Totul se bazează pe o idee extrem de simplă: sunt oameni (mai puţini de 2) pentru care volumul necesar pentru depozitarea banilor este o problema aşa că noua tehnologie permite îmbutelierea resurselor monetare la o presiune extrem de mare. Practic într-un spray standard de 150ml se pot presuriza până la 1 milion de dolari. Bineînţeles start-up-ul va pune pe piaţă butelii de toate dimensiunile: de la baxuri cu spray-uri de 150ml, pentru cumpărăturile de zi cu zi, până la ferme de tancuri cu volume de pană la 300.000 litri. Imaginaţi-vă cât de comod va fi pt. domnul Ţiriac să plătească o maşină de exemplu. Doar scoate şpray-ul din buzunar şi şpreiază un puf sau două. Managerul firmei ne dezvăluie câteva date: 'Suntem la început, deci mai avem şi probleme, mai sunt unele lucruri de ajustat, dar e clar că vom câştiga şi noi un spray cu bani în urma acestei afaceri. Se ştie că domnul Ţiriac este mai zgârcit şi ne-a dat pentru probă câteva fise la presurizat. Cum încă procesul tehnologic este în dezvoltare am băgat presiune prea mare şi-acum domnul Ţiriac are un spray cu diamante.'   	tiriac, bani, spray, dolari, miliardar
https://neurococi.ro/posts/Scandia-Sibiu-incearca-preluarea-ostila-/	Scandia Sibiu încearcă preluarea ostilă a gigantului Facebook.	      Pentru că în ultimele zile vânzările de conserve au explodat şi nu se mai găseşte tablă, Scandia Sibiu a achizitionat pachetele de acţiuni Facebook deţinute de Vanguard si Blackrock. 'N-avem ce face cu banii. Nu mai găsim tablă, că maglavais de-ăla de umplut conserva avem din belşug, nu-i problemă. Avem depozitu plin de făină, soia, amidon, sare, zahăr, carmin, gluten, nitriţi şi apă căcălău, putem face zeci de mii de tone de pate de ficat, dar ciu-ciu tablă. Am scos pe piaţă un lot experimental din tablă de 12, singura disponibilă după ce am devorat toate stocurile, dar cumpărătorii s-au plâns că autogenu' arde pateul şi nu pot decât să-l fumeze dar legislaţia interzice fumatul pateului în spaţiile închise. Ca o ultimă soluţie, am luat ultimele burlane din Dedeman să improvizăm nişte cutii de conservă dar după ce se termină şi-ăstea n-avem ce face. Trebuie să luăm ceva Facebook, Google sau măcar un TikTok două, că aeru' nu se termină niciodată.'   	scandia, facebook, conserve, pateu, ficat, autogen, takeover, sibiu, sudura, bursa
https://neurococi.ro/posts/Atentie-Trupa-Taxi-a-obtinut-Autorizatia/	Atenţie! Trupa Taxi a obţinut Autorizaţia de Construcţie pentru balcon.	      Biroul de Urbanism a încercat mai multe tertipuri ca să-i întârzie pe cântăreţi: le-a cerut aviz de la gaze, curent, Apele Române, OSIM, Biroul de Turism pentru Tineret, ANPC, Direcţia Slvică, Direcţia Judeţeană de Statistică, Institutul de Fizică al Pământului, Centrul de Formare și Inovație pentru Dezvoltare în Carpați şi Registrul Auto Român. Băieţii de la Taxi nu s-au descurajat, şi-au pus chitara-n husă, şi într-o singură zi au obţinut toate avizele. Cel mai greu a fost la Mărmureanu unde a fost nevoie să tragă fermuarul la husă până la jumătate. 'Asta e, noi am încercat să-i întârziem dar, vă daţi seama că până la urmă ar fi desfacut husa aia la noi în birou şi nu numai că obţineau Autorizaţia dar le-am fi asigurat şi execuţia lucrării. Ne pare rău de vecini. Le-am trimis tuturor scuzele noastre precum şi autorizaţiile pentru zidirea balcoanelor, din oficiu.'   	trupa, taxi, balcon, autorizatie, urbanism, cantat, chitara
https://neurococi.ro/posts/Turisti-raniti-pe-plaja-de-caderi-de-ghi/	Turişti răniţi pe plajă de căderi de ghiuluri!	      Ministerul Turismului ne dă un pont: 'Când avionul ce zboară de-a lungul litoralului nu tractează banerele Toortitzi, NetBet sau Nutline ci o sârmă cu chiloţi şi maieuri, e semn că a venit domnul Ţiriac la mare şi îşi usucă lenjeria intimă. Turiştii neatenţi pot fi loviţi de ghiuluri, teancuri de bancnote, sau, doamne fereşte, de lingouri.' Un turist revoltat ne mărturiseşte şi el: 'Am ieşit la plajă cu nevastă-mea şi cu mă-sa şi vai ce ghinion dom'le...au căzut la câţiva centimetri de soacră-mea 5 lingouri! Pilotul este inuman!'   	tiriac, litoral, avion
https://neurococi.ro/posts/Geoana-a-tras-lozul-cel-mare-Din-pacate-	Geoană a tras lozul cel mare. Din păcate şi acesta e necâştigător.	      Jens Stoltenberg, despre rolul lui Geoană în structura NATO: 'Era cam tristă atmosfera prin birourile NATO şi ne-am gândit să ne destindem puţin, să aducem puţin fun. În fiecare dimineaţă îl anunţăm pe domnu' Geoană că am pornit un război pe undeva, seara îl anunţăm că l-am câştigat şi a doua zi dimineaţa, în timp ce îi spunem că am pornit un nou război, îi comunicăm că l-am pierdut pe ăla de ieri. E incredibil cât poate să se bucure în fiecare seară. Am terminat ţările de mult şi le repetăm o dată la 200 de zile, dar nu şi-a dat seama. Azi dimineaţa i-am spus pentru a şasea oară că am pornit război cu România. A sunat-o pe Mihaela şi i-a spus să nu deschidă la nimeni că e război şi poate intră soldaţi încălţaţi pe persane. I-am dat şi un buton luat de la Praktiker şi i-am spus că e buton nuclear. De dimineaţă tot apasă pe el şi ne întreabă daca l-a nimerit pe unu Băsescu.'   	geoana, nato, razboi, nuclear, romania, basescu
https://neurococi.ro/posts/Studiourile-Marvel-i-au-facut-lui-CTP-o-	Studiourile Marvel i-au făcut lui CTP o ofertă cu multe zerouri după ce acesta a fost fotografiat într-un restaurant în timp ce-şi pregătea singur cina.	      O fotografie cu CTP care prăjeşte dezinvolt un creier într-un restaurant din Centrul Vechi al Bucureştiului a ajuns acolo unde trebuie. Studiourile Marvel au întrerupt filmările la noua producţie, au împuşcat scenaristul şi i-au făcut o ofertă de nerefuzat CTP-ului. Deşi CTP îşi face numărul de peste 20 de ani, românii au crezut că cei din platou au venit cu creierele prăjite de acasă. Noile fotografii dezvăluie un fapt alarmant: super-eroul a prăjit şi mii de creiere noi-nouţe ale telespectatorilor care au făcut imprudenţa să îl urmărească.   	ctp, tudor popescu, prajit, creier, marvel
https://neurococi.ro/posts/Ziua-II-Progresul-constructiei-spitalulu/	Ziua II. Progresul construcţiei spitalului din China.	      Primele imagini cu progresul construcţiei spitalului care va fi construit în China în 6 zile fac ocolul globului. Do Rel Qiang, dirigintele de şantier, a făcut grăbit următoarea declaraţie de presă: 'Avem o mică problemă dar aşteptăm sa aterizeze dintr-un moment în altul o echipă de experţi din Caracal!'   	china, dorel, excavator, spital, coronavirus, gropi, santier
https://neurococi.ro/posts/O-doare-capul-A-aparut-prezervativul-cu-	O doare capul? A apărut prezervativul cu Nurofen!	      Principala problemă a bărbaţilor căsătoriţi s-a rezolvat! În sfârşit există o soluţie elegantă pentru celebrele 'Nu pot dragă, mă doare capul', 'am o migrena' sau 'simt că mă ia gripa': prezervativele cu Nurofen pentru durere sau Nurofen pentru răceală şi gripă sunt făcute să vină în sprijinul soţiilor lor în acele grele momente de boală. A.P. din Tecuci, bucuros că şi-a salvat soţia încă de la primele simptome de răceală, ne relatează dialogul cu pacienta:  - Vai dragă ce rău mă simt..cred că mă ia o răceală  - Vai săraca de tine... bine că am cumpărat prezervative cu Nurofen că nu-mi place să văd cum te chinui.  - Ce!?!..vai dragă dar cât ţii la mine..ok..fă-mi repede 'injecţia' să ne culcăm!  - Ia te uită!...pe pachet scrie Administrare Orală!   	prezervativ, nurofen, durex, raceala, gripa, doare capul
https://neurococi.ro/posts/Pe-platforma-Zoom-au-aparut-primele-plos	Pe platforma Zoom au apărut primele ploşniţe.	      Experienţa online se apropie tot mai mult de viaţa reală. Câţiva studenţi la Politehnică au sesizat apariţia primelor ploşniţe pe platforma online Zoom. Mărăcine M, student din Severin, descrie experienţa: 'Mi-e clar că colegul 212.86.82.127 din Reşiţa i-a adus în reţea. Tocmai îmi trimisese mama în living un borcan cu zacusca de-aia buna de ciuperci când antivirusu meu m-a avertizat să pun capacu'.' 212.86.82.114: 'Fii serios mă Mărăcine că noi n-avem ploşniţe. Precis i-a adus Jeni de la Chimie, c-am văzut-o pe IP-u' lu' Hasan. Da' nu-i bai, băh...am auzit că studenţii din vechime aveau ploşniţe şi făceau sex. Probabil că ajută la polenizare, man.'   	zoom, studenti, camin, politehnica, plosnite, gandac, severin, resita, invatamant, online
https://neurococi.ro/posts/angelina-de-craciun	Angelina de Craciun	      n-a găsit nimic sub prun nici sub sălcii, nici sub tuie, doar sub Brad lua una mu*e   	angelina, brad, pit, craciun  
https://neurococi.ro/posts/Marmureanu-avertizeaza-Trupa-Taxi-poate-/	Mărmureanu avertizează: Trupa Taxi poate să mai scoată o piesă în orice moment!	      Profesorul Mărmureanu estimează că lunga perioadă de acalmie a trupei Taxi nu prevesteşte nimic bun: 'Energiile acumulate sunt imense. Nu pot decât să fiu extrem de rezervat mai ales că în ultimul timp s-a construit extrem de prost, şi-n blocuri se aude tot ce fac vecinii. Probabil vor fi mii de victime. Este esenţial ca populaţia să fie pregătită şi încă de la primele acorduri să se arunce repede sub o faţă de masă cât mai groasă.' n.r. După ce am terminat acest articol am aflat că trupa Taxi a scos de fapt un album anul trecut. Nu putem decât să le mulţumim pe această cale vecinilor noştri pentru faptul că nu au pus botul la perpetuarea undelor trupei Taxi aşa că evenimentul nu a produs pagube la noi în bloc.   	cutremur, taxi, trupa, marmureanu, muzica
https://neurococi.ro/posts/Ranitii-obiecteaza-Cum-adica-pomenirea-m/	Răniţii obiectează: 'Cum adică pomenirea morţilor?'	      Mii de răniţi s-au adunat pe-o treaptă a Catedralei Mânturii Neamului şi cer Preafericitului să corecteze această nedreptate. 'Zi de zi milioane de români ne menţionează şi pe noi odată cu pomenirea morţilor unor doamne! E strigător la cer că, noi răniţii, nu suntem pomeniţi deloc în cadrul acestui frumos obicei. Vă daţi seama ce plictisitor ar fi traficul în Bucureşti dacă noi n-am fi pomeniţi? Ce, era aşa greu ca această zi să fie denumită 'Pomenirea morţilor şi răniţilor'? Puţin respect cerem! Atât!' 'Io am venit aici că am crezut că se dau ceva ajutoare, da' acu', când am văzut cu ochii mei ce se întâmplă, am hotărât să rămân. Stau aici cu fraţii mei şi cer să ni se facă dreptate. Ce plm m-am rănit degeaba? Sunt în pensie de boală din '94 pentru că sunt orb, ce te uiţi aşa?'   	pomenirea mortilor, morti, raniti, pomenire, catedrala, protest, bor
https://neurococi.ro/posts/Dupa-ce-a-vazut-ca-nu-prea-e-bagata-in-s	După ce a văzut că nu prea e băgată în seamă, Cuminţenia Pământului a început să-şi desfacă puţin picioarele.	      Paznicii Cuminteniei Pământului au observat în ultimul timp cum aceasta îşi schimbă încet-încet forma. Măsurătorile arată că genunchii Cuminţeniei se depărtează cam cu 1 cm/lună făcând din acest fenomen cel mai tensionat moment de streap-tease (faza la sol) a unei bucăţi, fie ea şi de piatră. Cu ochii pe bulanele Cuminţeniei puţini au observat că deja zâmbeşte şi se uită printre gene. Paznicii cu înclinaţii către artă nici nu se mai duc acasă. Stau toţi pe scaune aşezate în faţa statuii şi aşteaptă momentul în care trebuie să-i schimbe numele. Unul dintre ei ne mărturiseşte: 'A dat norocu peste noi.. ca naţie vorbesc..cine ar fi dat 6 milioane pe o statuie tristă, care nu-ţi stârneşte imaginaţia în nici un fel? Cioloş s-a luptat cu morile de vânt...sau poate are el un fetiş, nu ştiu, dar cu curu strâns şi cu genunchii lipiţi nu prea ajungi să reuşeşti în viaţă...oricum noi aştia, paznicii care iubesc cu adevărat arta, am cumpăra imediat statuia dacă am avea bani. Zilnic îi punem termometrul, deocamdată pe frunte, să vedem dacă se şi încălzeşte puţin, că aşa e cam ca nevastă-mea.'   	cumintenia, ciolos, brancusi, pamantului
https://neurococi.ro/posts/Daca-dumnezeu-nu-exista-cine-le-a-pus-pl/	Dacă Dumnezeu nu există, cine le-a pus p*la pe nas? Şah-Mat Ateiştilor!	      Creştini 1, Atei 0.   	crestini, atei, sah-mat, dumnezeu
https://neurococi.ro/posts/Alte-dezvaluiri-pe-care-le-va-face-Arafa/	Alte dezvaluiri pe care le va face Arafat dupa alegeri.	      Panică în serviciile secrete occidentale după declaraţia recentă a lui Arafat: 'Am răspunsuri la toate întrebările dar le voi da după alegerile prezidenţiale'. O criză mondială de popcorn este inevitabilă, populaţia întregii planete începând deja pregătirile pentru tranmisia televizată a răspunsurilor lui Arafat. Vom afla în sfârşit cine l-a împuşcat pe Kennedy, câte duble s-au tras la aselenizare, cât silicon mai este în rezerva de ţâţe, glicemia lui Iliescu, ce mustaţă purta tata lui Merkel, cât îl ţin bateriile pe Zuckerberg, în general răspunsuri la toate întrebările pe care şi le poate pune un fraier fără imaginaţie. Colegii domnului Arafat, Regina Angliei şi Mugur Isărescu, care au şi ei posturile luate pe viaţă, sunt nedumeriţi cu privire la promisiunea făcută de şeful ISU: 'Ăsta mic a prins el ceva meserie, dar e cam naiv. Are încă impresia că trebuie să dea răspunsuri.'   	arafat, isu, servicii, merkel, regina, isarescu, zuckerberg
https://neurococi.ro/posts/we-are-your-fathers	We are your fathers!	      Pick up your swords, madafakas   	vader, jedy, papa, starwars
https://neurococi.ro/posts/Banii-de-alocatie-inlocuiti-cu-abtibilde/	Banii de alocaţie înlocuiţi cu abţibilde cu fotbalişti din colecţia Guma Turbo.	      Pentru că ideea lui Orban şi Cîţu de acordare a alocaţiilor în vouchere a stârnit controverse în urma cărora jumătate dintre români o înjură pe tanti Orban iar cealaltă jumătate pe maimuţa Cita, primul ministru a venit cu o idee şi mai bună: alocaţiile se vor acorda în abţibilde cu fotbalişti, atât de populare în anii '90. Orban face lumină în acest caz: 'Scopul era să oprim milioane de familii de români să trăiască de pe urma celor 5 lei/zi. Ne-am gândit iniţial la vouchere care să poată fi folosite numai în sistemul de sănătate, de educaţie sau în biserici, adică în tot ce-avem noi mai bun în ţara asta, dar se pare că ne-am lovit de o opoziţie puternică: părinţii care folosesc alocaţia să-şi cumpere cinci ţigări şi ai căror copii trăiesc cu 0 lei pe lună. Abţibildele însă vor fi cu siguranţă îndrăgite atât de copii cât şi de părinţii acestora şi vor putea fi cu uşurinţă schimbate între posesori, astfel încât la majorat fiecare copil să aibă măcar echipele Germaniei si Argentinei complete. Eu am strâns o grămadă de abţibilde în tinereţe şi nici acum nu m-aş despărţi de abţibildul cu Maradona fără să iau pe el măcar un Van Basten şi 2 Zidani, desigur.'   	orban, cîţu, alocatie, abtibilde, guvern
https://neurococi.ro/posts/Desi-in-Romania-timpul-sta-in-loc-vom-tr	Deşi în România timpul stă în loc, vom trece totuşi la ora de vară.	      Veşti bune pentru studenţii români care credeau ca o să treacă numai în sesiunea de toamnă. La Bruxelles s-a hotărât ca România să treacă totuşi şi ea la ora de vară chiar dacă Raportul privind Mecanismul de Cooperare şi Verificare a Fusului Orar a scos la iveală numeroase neregului în ţara noastră. Raportul menţionează o anomalie in ceea ce priveşte scurgerea timpului în România: În timp ce in vestul Europei trece o secundă, la noi stă o secundă. Populaţia s-a împărţit în 2 tabere: una susţine că secunda care stă în Romănia este cea care a trecut prin Germania, iar cealaltă afirmă că este o secundă lansată în România de pe un submarin rusesc la începutul anilor '50. Cele 2 tabere stau deja faţă-în-faţă în piaţa Victoriei dar la ore diferite.  Ultima oră! O a treia tabără începe să se concentreze în jurul redacţiei neurococi.ro, şi anume cei care au observat că în timp ce în România trece un Euro, în Germania intră un Euro.   	romania, ora de vara, buxelles
https://neurococi.ro/posts/Romanii-au-hotarat-Licinius-cel-mai-pros	Romănii au hotărât: Licinius, cel mai prost împărat roman.	      'Dă-l în plm. Un om crud: a omorât într-o zi 42 de mucenici. E sărbătoarea mea preferată şi în fiecare an de 6 Martie încerc să beau 42 de pahare cu vin dar pe la 30 mi se face greaţă. Putea să-i omoare şi el în doua ture. Ce atâta grabă? Dacă nu era aşa de crud putea să omoare de exemplu 21 în 6 şi pe restu-n 8 să ne dregem şi noi în 7. Unde mai pui că în 8 martie aveam şi noi un prilej de sărbătoare.' 'Zice bine colegu'. Nu putem bea dom'le 40 de pahare de vin într-o seară! Păi aţi mai fost voi la băut vinerea şi după fiecare 2 pahare să nu apară un comesean cu un metru de shoturi de Tequila? E inuman! Poate pentru străbunii noştri a fost ok, că beau vin făcut din struguri, dar acum efectiv put a sulf în 7 martie, şi-n 8 tre să mă spăl!'   	roman, imparat, mucenici, 42, pahare, vin, tequila, sulfprost, crud
