url	title	body	keywords
https://www.timesnewroman.ro/blog/ma-fut-vacantele-tale-iohannis/	Mă fut în vacanțele tale, Iohannis!	Sunt uluit! Klaus Iohannis a rostit cuvintele astea: ”În ultimii doi ani nu am mai avut vacanțe deloc fiindcă am stat să păzesc România de PSD-iști”. Serios, asta e problema lui, că n-a putut pleca în vacanțe? Ca om care am stat (ca tâmpitul, se pare) în stradă de zeci de ori în ultimii ani, mă iau toți dracii când aud declarația asta.   Plm, Iohannis, știi când am ieșit eu în stradă să protestez prima dată împotriva guvernului lui Dragnea? La 10 minute după ce am aflat că s-a dat ordonanța 13! Eram deja îmbrăcat și ieșeam pe ușă. Pe 31 ianuarie 2017. Hai să-ți zic și contextul: soția mea ieșise din spital de câteva zile, că tocmai îl născuse pe al doilea meu copil. Avea mai puțin de 2 săptămâni de viață când s-a dat ordonanța aia nenorocită. Și am fugit spre Piața Victoriei fără să știu de ce mă duc acolo. Am ieșit ca să fac ceva, ca să nu rămân fără de reacție la mizeria făcută de pesediști. Și apoi am mai ieșit în stradă, toată iarna și toți anii următori, de zeci de ori. Am plecat fără să stau pe gânduri, deși aveam un copil abia născut, care din fericire dormea la ora aia și-mi permitea să plec fără să dau explicații soției (ea a aflat abia a doua zi că eu am fost la protest). Și vii tu, acuma, să te dai mare că n-ai avut vacanțe în ultimii doi ani. Tu, care ești președintele țării și ăsta e jobul tău, să veghezi că nu fac mizerii ăia de la guvernare, în timp ce eu sunt un simplu cetățean. Să mă fut în vacanțele tale! Cerșești empatie pentru că n-ai avut vacanțe, când eu și zeci de mii de alți români ca mine ne-am futut serile și nervii în stradă ca să protestăm împotriva pesediștilor ălora cu care cumva vrei să lași impresia că doar tu te-ai luptat. Da, te-ai luptat cu ei până ai decis să le mai dai o șansă la guvernare nu o dată, ci de trei ori. ”Trei, în pula mea!”, vorba maestrului Despot. Trei premieri de la PSD ai acceptat în mandatul tău.Dar, cu toate astea, o să te votez în turul doi. Nu am ratat niciun vot (ok, recunosc, n-am fost la ăla al coaliției medievale, dar ăla nu se pune), n-o să-l ratez nici pe cel de pe 24 noiembrie. Și normal că n-o să votez cu Dăncilă, o să te votez pe tine. Dar, încă o dată, să mă fut în vacanțele tale, Iohannis! 	sunt, uluit, klaus, iohannis, rostit, cuvintele, astea, ultimii, vacanțe, deloc, fiindcă, păzesc, românia, psd-iști, serios, problema, putut, pleca, tâmpitul, stradă, toți, dracii, când, declarația, astaplm
			
https://www.timesnewroman.ro/sport/premiul-pentru-cel-mai-misto-nume-din-romania-castigat-din-nou-de-basarab-panduru/	Premiul pentru cel mai mişto nume din România, câştigat din nou de Basarab Panduru	Fostul fotbalist Basarab Panduru a câştigat şi anul acesta Premiul Societăţii Române de Nume Şmechere Pentru Cel Mai Mişto Nume, depăşindu-i la mustaţă pe principalii trei contracandidaţi, un electrician de 49 de ani din Călăraşi pe nume Napoleon Bărbat, un poliţist din Deva pe care îl cheamă Traian Berbeceanu şi un tehnician silvic din Bistriţa, Horea Cloşca Crişan Lupu.   Ferdinand Viteză, fost campion la nume mişto şi membru al juriului de anul acesta, explică cum s-a făcut departajarea: „Am ţinut cont de faptul că pe Basarab Panduru îl cheamă şi Nică. Basarab Nică Panduru. Exact acea tuşă de candoare copilărească, de sensibilitate de care avea nevoie acest nume falnic ca să strălucească cu adevărat.”Juriul a analizat şi contestaţia depusă de Marc Aureliu Akebono, indicând că în actul de naştere pe acesta îl cheamă Marcel Grasu. „Se pun doar numele primite la botez, orice schimbare, fie şi pe căi legale, te descalifică”, a declarat Spartacus Părpepiepţescu, secretarul Societăţii. 	fostul, fotbalist, basarab, panduru, câştigat, acesta, premiul, societăţii, române, Şmechere, pentru, mişto, depăşindu-i, mustaţă, principalii, contracandidaţi, electrician, călăraşi, napoleon, bărbat, poliţist, cheamă, traian, berbeceanu, tehnician
			
https://www.timesnewroman.ro/politic/aur-acuza-ca-firmele-dacice-nu-sunt-primite-la-licitatiile-pentru-tuneluri/	AUR acuză că firmele dacice nu sunt primite la licitațiile pentru tuneluri	Liderul AUR George Simion cere ca toate lucrările la tuneluri din România, fie că sunt rutiere sau feroviare, să fie oprite imediat. El spune că e suspect că nici o lucrare de tunel nu a fost câștigată de o firmă dacică, în condițiile în care dacii au peste 2.000 de ani de experiență în domeniu.   „Am crezut că-mi pleznește o venă când am văzut că tunelul de pe viitoarea autostradă Pitești-Sibiu va fi făcut de o firmă austriacă“, s-a plâns liderul AUR. „Nu se mai poate așa ceva! Toate licitațiile trebuie anulate și repetate. Am informații clare că firmele dacice nu au fost lăsate până acum la licitațiile pentru tuneluri. E obligatoriu să participe și ele!“George Simion spune că firmele dacice pot termina un tunel cu de până la 174 de ori mai repede decât orice firmă străină. „Dacii au făcut kilometri întregi de tuneluri cu tehnologia de acum 2.000 de ani, deci probabil azi le-ar lua câteva ore ca să facă un tunel de un kilometru prin munți“, este convins liderul AUR. 	liderul, george, simion, toate, lucrările, tuneluri, românia, rutiere, feroviare, oprite, imediat, spune, suspect, lucrare, tunel, câștigată, firmă, dacică, condițiile, dacii, peste, experiență, domeniu„am, crezut, că-mi
			
https://www.timesnewroman.ro/politic/judecatoarea-blestemata-de-udrea-s-a-trezit-cu-basescu-la-usa/	Judecătoarea blestemată de Udrea s-a trezit cu Băsescu la ușă	Blestem greu lansat de Elena Udrea la adresa judecătoarei care a condamnat-o la 8 ani de pușcărie. Din păcate pentru judecătoare, blestemul s-a îndeplinit deja și Traian Băsescu era aseară la ușa judecătoarei, cu un trandafir în dinți și o sticlă de Sânge de Taur, din care băuse deja jumătate, ca să prindă forțe.   Deși nu știm precis cum suna blestemul, se pare că Băsescu avea un plan bine gândit. ”Am venit să-ți spun un vers și să ți-o dau ca la Anvers”, ar fi exclamat Băsescu în fața judecătoarei, cu șlițul desfăcut, după care ar fi avut un acces de râs, tipic fostului președinte.”Ia zi, vrei să vezi ce înseamnă rău de mare?”, ar fi întrebat-o Băsescu. Drept replică, magistratul l-a întrebat dacă a venit în legătură cu un verdict și Băsescu i-a spus că da, și că are un verdict cât o mână de copil. Judecătoarea i-a făcut plângere Elenei Udrea pentru blestem: ”A zis să simt și eu ce-a simțit ea și nu-mi convine, n-o să uit prea curând damful ăla de băutură”. 	blestem, lansat, elena, udrea, adresa, judecătoarei, condamnat-o, pușcărie, păcate, pentru, judecătoare, blestemul, îndeplinit, traian, băsescu, aseară, trandafir, dinți, sticlă, sânge, băuse, jumătate, prindă, forțedeși, știm
			
https://www.timesnewroman.ro/it-stiinta/dacia-anunta-o-masina-si-mai-ecologica-decat-spring-dacia-imping/	Dacia anunţă o maşină şi mai ecologică decât Spring, Dacia Împing	Dacia face progrese tehnologice uimitoare. După lansarea Daciei electrice model Spring, cei de la Mioveni anunță un model și mai revoluționar, 100% ecologic, numit Dacia Împing. Noua mașină are autonomie în funcție de cât a mâncat șoferul în dimineața respectivă și garantează un trafic foarte silențios, întrerupt doar de icnetele deținătorilor de Dacii Împing, mai ales la deal.   Pentru deplasările în pantă, Dacia Împing e dotată cu o cremalieră, riscul să vină peste șofer fiind redus considerabil. La vale șoferii vor putea chiar să stea la volan și să se relaxeze cât timp gravitația lucrează pentru ei. Clienții de Dacia Împing sunt deja fascinați de noua mașină: ”Are kitul de tractare cu cai montat din fabrică. La portbagaj are un pahar special pentru băuturile energizante, care te ajută s-o împingi chiar și cu 20 km/h”, spun fanii Dacia.Nici confortul din habitaclu nu a fost neglijat. Dacia Împing vine cu un bol pentru iaurt cu goji în loc de scrumieră. Trusa de scule include și mănuși, ca să nu faci bătături când împingi mașina și totul este rezumat în noul slogan Dacia Service: ”Noi ți-o tragem, tu Împingi!”. 	dacia, progrese, tehnologice, uimitoare, după, lansarea, daciei, electrice, model, spring, mioveni, anunță, revoluționar, ecologic, numit, dacia, Împing, mașină, autonomie, funcție, mâncat, șoferul, dimineața, respectivă, garantează
			
https://www.timesnewroman.ro/unde-iesim/dana-florian-live-in-lloyds-pub/	Dana Florian, live în Lloyd’s Pub	Vineri, 26 februarie, concert Dana Florian în Lloyd’s Pub. Cantautoare din noul val de muzică folk, Dana Florian a fost remarcată pentru autenticitatea scenică, pentru melodiile ei surprinzătoare cu diferite influențe de jazz, blues sau pop, pentru vocea ei unică și tehnica instrumentală la chitară. Cântecele ei, compuse sensibil și interpretate cu dezinvoltură, vorbesc despre viată în firescul ei, de la cele mai profunde emoții și trăiri pană la lucruri nostime sau satirice.   La eveniment va participa, bineînțeles, și berea TNR. Intrarea este liberă, doar că locurile sunt limitate. Cu berea TNR e invers – e pe bani, dar în cantități nelimitate. 	vineri, februarie, concert, florian, lloyds, cantautoare, muzică, remarcată, pentru, autenticitatea, scenică, melodiile, surprinzătoare, diferite, influențe, blues, vocea, unică, tehnica, instrumentală, chitară, cântecele, compuse, sensibil, interpretate
			
https://www.timesnewroman.ro/unde-iesim/ultima-seara-de-jazz-jam-session-cu-sorin-zlat-si-invitatii-la-terasa-el-grande-comandante/	Ultima seară de Jazz Jam Session cu Sorin Zlat si invitații la Terasa El Grande Comandante	Nu rata ultima seară de Jazz Jam Session cu Sorin Zlat Band și invitații la terasa El Grande Comandante, joi, 12 noiembrie, de la ora 17.00!Te invităm la un nou eveniment marca berea TNR, o seară cu bere, muzică bună, oameni frumoși, dans, povești și mâncare delicioasă, toate la minunata terasă din Calea Călărași nr. 55!Dacă ești pasionat de muzică și ai un instrument, vino cu el să cânți alături de artiștii serii:Sorin Zlat Senior- saxofonSorin Zlat Junior- pianCiprian Parghel- contrabasIntrarea este liberă, iar cine dorește poate să susțină artiștii așa cum crede de cuviință.Avem încălzitoare și umbrele pregătite la terasă.REZERVĂRI: 0728 556 043 – El Grande Comandante, Calea Călărași nr. 55 (există locuri de parcare în jurul terasei).    	concert, terasă
			
https://www.timesnewroman.ro/life-death/arafat-a-pus-somnifere-in-apa-de-la-robinet-sa-nu-mai-umble-romanii-noaptea-pe-afara/	Arafat a pus somnifere în apa de la robinet, să nu mai umble românii noaptea pe-afară	Diabolicul coordonator al activităților de pandemie a trecut la măsuri mai dure de control a populației, așa cum a promis dacă nu ne băgăm mințile în cap. La ordinul său cantități importante de somnifer au fost deșertate în apa potabilă din țară, ca toată lumea să fie în pat la ora 22.00. Sau pe unde-i apucă somnul.   Nimeni nu este in siguranță de apa cu somnifer, pentru că chiar dacă beau apă de la pet că i-a prostit publicitatea, pentru ciorbă românii folosesc tot apă de chiuvetă. Astfel, după o ciorbă de fasole cinstită seara în câteva minute orice cetățean ajunge în brațele lui Morfeu și se bășește liniștit sub plapumă.Întrebat dacă nu este cumva ilegal sau neconstituțional să bagi în cetățeni substanțe fără cunoștința lor, medicul Raed Arafat a spus că democrația a fost suspendată de ceva vreme și doar drogații nu-și dau seama de asta. Totodată a recomandat în continuare vaccinarea cu Astra Zeneca, că are el un prieten care garantează pentru vaccinul ăsta. 	diabolicul, coordonator, activităților, pandemie, trecut, măsuri, control, populației, promis, dacă, băgăm, mințile, ordinul, cantități, importante, somnifer, deșertate, potabilă, țară, toată, lumea, unde-i, apucă, somnulnimeni, siguranță
			
https://www.timesnewroman.ro/blog/studiu-legumele-romanesti-sunt-cele-mai-gustoase-pentru-ca-piete-e-mult-fum-de-mici/	Studiu! Legumele româneşti sunt cele mai gustoase pentru că în pieţe e mult fum de mici	Legumele din România chiar sunt cele mai gustoase din lume! O arată un studiu recent al Institutului pentru Legume „Marcel Belmondo” din Franţa. Şi mai surprinzător, însă, e că nu e vorba doar despre legumele crescute în România, ci şi despre cele de import, turceşti sau greceşti, vândute în pieţele noastre.   „Contează mai puţin solul, apa şi soarele, şi mult mai mult piaţa”, spune Jean Claude Saligny, cercetător. „Pieţele din România sunt pline de micării, iar fumul de mici pătrunde în porii legumelor, dându-le o savoare deosebită. Veşti proaste pentru vegani, însă: castravetele ăla e plin de microparticule de mici!”„E incredibil, la voi în ţară până şi salata verde are gust! Detectez note de vită, oaie, usturoi…”, apreciază Michel Vaillant, consultant în cadrul studiului.Acelaşi lucru nu poate fi spus însă despre florile din pieţe, pe care infuzia de miros de mici nu le face deloc mai atrăgătoare pentru persoana iubită – cu excepţia cazului în care persoana iubită are burtă şi poartă adesea şlapi. 	legumele, românia, chiar, gustoase, arată, studiu, recent, institutului, pentru, legume, marcel, belmondo, franţa, surprinzător, însă, vorba, despre, legumele, crescute, import, turceşti, greceşti, vândute, pieţele, noastrecontează
			
https://www.timesnewroman.ro/sport/probleme-cu-permisul-lui-florinel-coman-are-voie-sa-conduca-doar-tancuri-rusesti/	Probleme cu permisul lui Florinel Coman! Are voie să conducă doar tancuri rusești	Veşti proaste pentru îndrăgitul jucător de fotbal Florinel Coman! Permisul ucrainean de conducere pe care îl folosea acesta nu doar că e obţinut pe căi ilicite, dar e şi categoria greşită.   Potrivit autorităţilor, documentul obţinut în Ucraina îi permite fotbalistului să conducă exclusiv vehicule blindate grele tip tanc, şi nici măcar orice fel de tancuri, ci doar pe cele de provenienţă sovietică.„În Ucraina, categoriile sunt puţin diferite. Dacă la noi A e pentru motociclete şi B pentru autovehicule mici, la ucraineni A-ul e pentru maşini obişnuite iar B-ul e pentru ‘vehicule cu şenile, blindaj şi turelă fabricate în fosta Uniune Sovietică’. Astfel de permise sunt foarte utile acolo. Aici, mai puţin. Cred că sunt maximum 5 tancuri sovietice în circulaţie în România în zilele noastre”, explică Gigel Vârtej, poliţist rutier.„Dacă era obţinut legal şi ţinea morţiş să şi-l echivaleze, carnetul de tanc din Ucraina îi permitea, totuşi, să conducă un Oltcit”, adaugă Boris Popescu, specialist în permise. 	veşti, proaste, pentru, îndrăgitul, jucător, fotbal, florinel, coman, permisul, ucrainean, conducere, folosea, acesta, obţinut, ilicite, categoria, greşităpotrivit, autorităţilor, documentul, ucraina, permite, fotbalistului, conducă, exclusiv, vehicule
			
https://www.timesnewroman.ro/politic/drula-a-gasit-nereguli-grave-la-metrorex-s-a-facut-metrou-in-drumul-taberei/	Drulă a găsit nereguli grave la Metrorex: „S-a făcut metrou în Drumul Taberei“	Ministrul Transporturilor spune c-au fost găsite extrem de multe probleme la Metrorex, dar una dintre ele este de-a dreptul scandaloasă. „Tâmpiții, că altfel nu am cum să le zic, au construit metrou în Drumul Taberei, într-o batjocură totală față de banul public“, a acuzat Cătălin Drulă.   „Nu înțeleg ce-a fost în capul lor? De ce să faci metrou într-o zonă care n-are nicio legătură cu Bucureștiul? De ce în Drumul Taberei și nu la Ciorogârla sau Bragadiru, dacă tot îl faci în afara orașului? Nu-mi vine să cred că avem metrou în Drumul Taberei, iar noi încă avem zone în București fără metrou. E incredibil!“La fel de șocat a fost și primarul Capitalei, Nicușor Dan, care a descoperit că Drumul Taberei a fost alipit ilegal la București și este considerat, în acte cel puțin, ca făcând parte din oraș. „Am verificat de mai multe ori și da, din păcate Drumul Taberei este considerat cartier bucureștean“, a anunțat Nicușor Dan. 	ministrul, transporturilor, spune, găsite, extrem, multe, probleme, metrorex, dintre, dreptul, scandaloasă, „tâmpiții, altfel, construit, metrou, drumul, taberei, într-o, batjocură, totală, față, banul, public, acuzat, cătălin
			
https://www.timesnewroman.ro/monden/pitipoance-inghetate-gasite-de-politie-pe-o-terasa-dupa-o-petrecere-ilegala/	Pițipoance îngheţate, găsite de Poliție pe o terasă după o petrecere ilegală	Scene de groază pe o terasă din Capitală, unde zeci de pițipoance au fost găsite înghețate în urma ninsorilor de peste noapte. Polițiștii sosiți pentru o razie de rutină au constatat că în jurul orelor 20:00 s-a terminat gazul din încălzitoare și pițipoancele, îmbrăcate în rochițe și pantofi stiletto, au degerat brusc, cu degetele înțepenite pe iPhone-uri, în timp ce-și făceau Live-uri sau selfiuri.   Primele indicii arată că pițipoancele participau la o petrecere ilegală, ieșiseră să fumeze și au fost surprinse de viscol. Mai întâi, polițiștii le-au amendat pe pițipoancele înghețate, după care au trecut la dezghețarea acestora, cel mai probabil urinând pe ele.Polițiștii spun că au fost scene greu de privit: ”Din cauza clănțănitului intens din dinți, mai multe pițipoance aveau botoxul spart, silicoanele erau înghețate în poziții nefirești și aveau cracii vineți, de la dârdăit”, spun polițiștii.Nu toate pițipoancele de la terasă erau înghețate complet, spun polițiștii: ”Când am pus o manea una din ele încă mai dădea din cur pe o masă, dar în rest era bocnă, îi înghețase fondul de ten și-i căzuse cu jumătate de meclă pe jos”. 	scene, groază, terasă, capitală, pițipoance, găsite, înghețate, ninsorilor, peste, noapte, polițiștii, sosiți, pentru, razie, rutină, constatat, jurul, orelor, terminat, gazul, încălzitoare, pițipoancele, îmbrăcate, rochițe, pantofi
			
https://www.timesnewroman.ro/descopera-romania/descopera-candidatii-la-prezidentiale-13-lucruri-despre-alexandru-cumpasanu/	Descoperă candidații la prezidențiale! 13 lucruri despre Alexandru Cumpășanu	• Numele lui real este Marian Cumpănaşu, doar că şi-a falsificat până şi certificatul de naştere;   • Deși insistă să le zică fanilor săi cumpănași, denumirea corectă este tâmpiți; • Pe de altă parte, e normal să nu avem niciun fel de așteptări de la Cumpănașu, că doar e născut în Caracal;• Live-urile în care susține că se luptă cu clanurile sunt de fapt filmări de când se joacă în reţea World of Warcraft;• E candidatul care poate asigura continuitatea la Cotroceni. La fel ca Iohannis, și Cumpănașu a obținut lucruri folosindu-se de acte false;• Ce-i scapă lui Cumpănaşu este că imunitatea prezidențială nu acoperă şi cazurile de ospiciu;• Nu mai e invitat la Antena 3 pentru că e Gâdea invidios pe fruntea lui uriaşă;• Deși se crede extrem de relevant, Cumpănașu este atât de insignifiant încât nici măcar nu l-a făcut Tăpălagă borfaş;• E evitat de toate televiziunile nu pentru că ar avea ceva cu el, ci pentru că pute;• Alexandru Cumpănașu e prima victimă a legii care-a făcut ca unele medicamente să nu se mai producă;• Și Vadim mai uita câteodată să-și ia pastilele, dar el măcar era haios, nu penibil, ca Cumpănașu;• A generat o mare dilemă printre români: care jignire e mai gravă, ”băi dăncilule” sau ”băi cumpănaşule”?• Totuși, dacă e să gândim la rece, mai bine îl punem preşedinte, că aşa încasează 2000 de euro pe lună de la stat. Altfel, revine la venituri de 29.000 de euro lunar, ca expert cu diplome false. 	
			
https://www.timesnewroman.ro/unde-iesim/dan-manciulea-folkn-suflet/	Dan Manciulea – Folk’n suflet	Vineri, 12 februarie, concert folk cu Dan Manciulea în Lloyd’s Pub – str. Colței nr. 16. La eveniment va participa, bineînțeles, și berea TNR. Intrarea este liberă, doar că locurile sunt limitate. Cu berea TNR e invers – e pe bani, dar în cantități nelimitate.    	vineri, februarie, concert, manciulea, lloyds, colței, eveniment, participa, bineînțeles, berea, intrarea, liberă, locurile, limitate, invers, cantități, nelimitate
			
https://www.timesnewroman.ro/unde-iesim/ceauniada-de-toamna-in-gradina-la-jai/	Ceauniada de Toamnă • în grădină la J’ai	Weekendul ăsta, vremea ține cu noi. Așa încât, ne mobilizăm rapid și pregătim cea de-a 6-a ediție a Ceauniadei de Toamnă, alături de Kovács Anðrás.Încingem focul, punem ceaunele, apoi scoatem bucătarii în grădină și îi punem la treabă.Meniul arată cam așa:🥣 Supă gulaş – 17 lei🍲 Fasole cu ciolan și murături – 32 lei🥧 Placintă cu mere și nuci – 13 leiVă recomandăm să veniți de la 13:00 fix.Mâncarea e limitată, pân’ se termină ceaunul.Rezervări la telefon: 031 426 20 47    	weekendul, ăsta, vremea, ține, încât, mobilizăm, rapid, pregătim, ediție, ceauniadei, toamnă, alături, kovács, anðrásÎncingem, focul, punem, ceaunele, scoatem, bucătarii, grădină, treabămeniul, arată, așa🥣, supă, gulaş
			
https://www.timesnewroman.ro/life-death/ninge-jandarmii-pun-mana-pe-lopeti-dar-tot-ca-sa-ne-bata/	Ninge! Jandarmii pun mâna pe lopeți, dar tot ca să ne bată	Ninsorile din ultima zi au fost un pretext excelent pentru jandarmi să iasă din nou pe stradă. Înarmați cu lopeți, jandarmii au trecut imediat la fapte, numai că reflexul lor nu e să facă ceva util societății, ci să bată oameni, așa că au început să dea cu lopețile în trecători.   Martorii spun că jandarmii au început prin a da cu niște spray lacrimogen, ca să-i amețească bine pe cetățeni, apoi au chemat duba și au început să încarce răniții cu lopețile în dubă. Ca de obicei, dotarea băieților a fost ireproșabilă. Niciun jandarm nu a avut lopată de plastic, toți au avut lopeți de fier, să simtă fraierii că iau bătaie de la un jandarm român.Singurul moment în care jandarmii chiar au dat zăpada cu lopețile a fost ca să-l scoată pe un individ care se îngropase în zăpadă de frica lor. ”Păi bine, mă, ne faci să muncim ca să putem să te batem?”, l-ar fi apostrofat jandarmii pe cetățean. Jandarmii au demonstrat că sunt foarte ambițioși și au stat mai mult prin ganguri, unde nu ninge, dar sunt foarte mulți români care practic își cer o lopată peste ochi. 	ninsorile, ultima, pretext, excelent, pentru, jandarmi, iasă, stradă, Înarmați, lopeți, jandarmii, trecut, imediat, fapte, numai, reflexul, facă, societății, bată, oameni, început, lopețile, trecătorimartorii, niște, spray
			
https://www.timesnewroman.ro/monden/e-oficial-primavara-mii-de-burti-au-inceput-sa-se-iveasca-de-sub-tricouri		 	
			
https://www.timesnewroman.ro/monden/la-2200-arafat-va-veni-personal-sa-ne-bage-in-pat-sa-ne-inveleasca-si-sa-ne-pupe-pe-frunte/	La 22:00, Arafat va veni personal să ne bage în pat, să ne învelească şi să ne pupe pe frunte	Grupul de Comunicare Strategică™ a anunţat cea mai recentă măsură adoptată în cadrul planului de luptă anti-COVID19 de anul acesta – o măsură controversată, dar cu potenţialul de a fi foarte eficace în combaterea pandemiei.   Seară de seară, Arafat va veni personal la domiciliul fiecărui român ca să se asigure că se culcă la ora 22. „Precum un Moş Ene bărbierit, dar cât se poate de real, domnul Arafat va descinde la locuinţele noastre, ca prin minune, în fiecare seară. Cei pe care nu-i găseşte acasă vor găsi o nuieluşă şi o amenduţă în ghete a doua zi”, spune comunicatul oficial.„Pe noi, ăştia cuminţi, Arafat ne va băga în pătuţ, ne va înveli cu plăpumioara preferată, ne va citi din ‘1001 de nopţi’, ne va ura somnic pufos şi ne va pupa pe frunte de noapte bună”, a adăugat un reprezentant al Guvernului, trecut ulterior brusc de un fior rece.„Puricii să vă sărute!”, a glumit Arafat, confirmând însă că da, cam ăsta e planul pentru următoarele săptămâni. 	grupul, comunicare, strategică™, anunţat, recentă, măsură, adoptată, cadrul, planului, luptă, anti-covid19, acesta, controversată, potenţialul, foarte, eficace, combaterea, pandemieiseară, seară, arafat, personal, domiciliul, fiecărui, român, asigure
			
