url	title	body	keywords
https://www.timesnewroman.ro/monden/i-se-spune-daniel-sihastrul-un-roman-n-a-mai-intrat-pe-instagram-de-trei-zile/	I se spune Daniel Sihastrul. Un român n-a mai intrat pe Instagram de trei zile	Pustnicia e din ce mai atrăgătoare pentru români! Un bărbat de 42 de ani din judeţul Gorj n-a mai intrat pe Instagram de trei zile, pe facebook de vreo două şi apare ca offline pe WhatsApp de azi dimineaţă. În prezent, cei care îl mai văd „pe viu” spun că i-a crescut o barbă albă, lungă, şi a învăţat să vorbească cu animalele.   Cei câţiva prieteni care încă nu l-au uitat spun că le e dor de Daniel, pe care l-au poreclit Daniel Sihastrul, dar că nu vor să încerce să-l convingă să iasă din schimnicie şi să se întoarcă printre oameni.„Dacă aşa a simţit el chemarea, să nu mai pună poze cu ciorba pe care a mâncat-o azi şi să nu mai dea like la poze cu ciorba mea, înseamnă că aşa a vrut Domnul. Nu-i treaba mea să-i perturb planurile măreţe, chiar dacă pierd un like per ciorbă”, spune cu blândeţe nea Aurel, vecinul de la 4 al pustnicului.„N-are cum să reziste mai mult de o săptămână. Şi părintele Cleopa, pe vremea când locuia în pădure, mai intra cinci minute pe insta să vadă o pereche de crenvurşti pe şezlong în Maldive”, îşi dă cu părerea Eugenia, colegă de birou a lui Daniel Sihastrul. 	pustnicia, atrăgătoare, pentru, români, bărbat, judeţul, intrat, instagram, facebook, două, apare, offline, whatsapp, dimineaţă, prezent, crescut, barbă, albă, lungă, învăţat, vorbească, animalelecei, câţiva, prieteni, încă
			
https://www.timesnewroman.ro/monden/in-sfarsit-prin-bucuresti-au-aparut-adevaratii-vestitori-ai-primaverii-decolteurile/	În sfârşit! Prin Bucureşti au apărut adevăraţii vestitori ai primăverii, decolteurile	După luni de patimă, bărbaţii se pot în sfârşit bucura de primăvară. Încălzirea vremii a creat condiţiile necesare pentru ca decolteurile să scoată capul de sub haine, spre vădita satisfacţie a bărbaţilor.     „Asta cu ghioceii pe post de vestitori ai primăverii e o tâmpenie”, spune reputatul bărbat Decebal Popescu. „Poate în comunitatea gay să fie aşa, dar pentru noi, bărbaţii heterosexuali, venirea primăverii coincide cu apariţia decolteurilor pe stradă. Nu poţi avea erecţie de la ghiocei, ce naiba! Sau, dacă ai, înseamnă că ai o problemă!”Momentul ales de adevăraţii vestitori ai primăverii ca să-şi facă apariţia este cum nu se poate mai bun. „După depresia cauzată de triada groazei, Valentine’s Day, Mărţişor şi 8 Martie, bărbaţii chiar avea nevoie de apariţia decolteurilor pe stradă. E cel mai bun remediu, probabil singurul, la depresia în care ajung bărbaţii din cauza femeilor”, este convins reputatul bărbat. 	decolteu, vestitorii primaverii, femei, barbati, triada grozei, ghiocei, comunitatea gay
			
https://www.timesnewroman.ro/monden/primavara-se-face-tuica-adevarata-romanii-profita-de-reducerile-la-pufoaice/	Primăvara se face ţuica adevărată! Românii profită de reducerile la pufoaice	   Pe măsură ce aşa-numita ţuică de toamnă, cea de prune, se termină, românii încep să fiarbă cu sârg la celebra ţuică de primăvară! Mii de gospodari profită de reducerile la pufoaice din malluri, second-handuri şi bazaruri pentru a produce ieftin rachiul de pufoaică, o băutură extrem de apreciată pe tot întinsul ţării.„Toamna, pe o pufoaică din asta de la Zara dai şi 900 de lei, dar acum în martie o găseşti lejer cu două-trei sute. Îţi ajunge să faci şi zece vedre de rachiu. Sigur, ăsta din pufoaică de Zara e delicatesă, îl fac special pentru nunta lui fi-miu… Da’ găseşti pufoaice şi cu 20 de lei la târg. Şi alea-s bune, dar iese ţuica un pic amăruie”, explică Sile, ţuicar din Urziceni.„Asta e ţuica adevărată, domnule. Păi din prune se face şi magiun, care-i pentru copii. Din pufoaică se poate face magiun? Nu! Deci e pentru bărbaţi adevăraţi!”, argumentează Marcel, gospodar din Adjud.În vestul ţării se produce chiar şi pălinca de pufoaică, o ţuică de pufoaică mult mai tare, care însă nu poate fi fabricată decât din pufoaice de firmă, de la Gucci în sus. 	măsură, aşa-numita, ţuică, toamnă, prune, termină, românii, încep, fiarbă, sârg, celebra, primăvară, gospodari, profită, reducerile, pufoaice, malluri, second-handuri, bazaruri, pentru, produce, ieftin, rachiul, pufoaică, băutură
			
https://www.timesnewroman.ro/monden/decaderea-unui-sex-simbol-romica-tociu-drogurile-si-operatiile-estetice/	Decăderea unui sex simbol: Romică Țociu, drogurile și operațiile estetice	Legendarul actor de comedie Romică Țociu s-a destăinuit într-un interviu istoric la Oprah vorbind despre viața și cariera sa, adicțiile sale, femeile pe care le-a iubit și regrete târzii. Acesta a povestit cum drogurile și operațiile estetice i-au distrus cariera, dar nu s-a arătat foarte deranjat de acest aspect.   Actorul, care în tinerețe era pus pe același piedestal cu Robert Redford și Ovidiu Iuliu Moldovan, a mărturisit cum și-a dorit să semene cât mai mult cu idolul său, instalatorul Mario, dar fără bască. A aruncat zeci de mii de dolari pe operații estetice, dar asta e un mizilic pe lângă banii pe care-i arunca pe droguri. „Nici nu mai țin minte de câte ori înainte să intru cu Cornel Palade pe scena Teatrului de Vară de la Venus băgam câte o linie de cox cu regretatul Dem Rădulescu”, a rememorat Țociu.Odată un sex-simbol care frângea inimile adolescentelor pe litoral pe faleza de la Olimp, Romică Țociu arată acum departe de fizicul care l-a consacrat. Actorul spune că nu și-a refuzat nimic în viață și recunoaște că a făcut sex cu cel puțin 1000 de femei și posibil cu vreo doi băieți mai frumoși. A fost prins de nenumătate ori de paparazzi în poziții indecente, cum ar fi acest pictorial din revista Ciao, imediat după ce a „executat-o” pe soția șefului poliției rutiere Brașov. 	legendarul, actor, comedie, romică, Țociu, destăinuit, într-un, interviu, istoric, oprah, vorbind, despre, viața, cariera, adicțiile, femeile, iubit, regrete, târzii, acesta, povestit, drogurile, operațiile, estetice, distrus
			
https://www.timesnewroman.ro/monden/e-oficial-primavara-burtile-barbatilor-au-inceput-sa-se-iveasca-de-sub-tricouri/	E oficial primăvară! Burţile bărbaţilor au început să se ivească de sub tricouri	Ghioceii şi toporaşii nu sunt singurii vestitori ai primăverii! Prin păduri şi parcuri, burţile încep să scoată, timid, capul de sub tricourile, cămăşile şi maiourile unde şi-au petrecut iarna – semn că sezonul rece s-a sfârşit definitiv.   „E superb, un tablou primăvăratic ca-n cele mai frumoase picturi ale lui Rubens! Cum să nu te inspire aşa o imagine?”, spune Sanda T., o bucureşteancă în a cărei grădină a răsărit un mănunchi proaspăt de burţi păroase.„Să ne bucurăm de ele cât putem!”, avertizează Gigi Popa, biolog. „Din cauza încălzirii globale, a veganismului, a înmulţirii sălilor de fitness şi mai ales a crizei economice, burta de primăvară ar putea dispărea până în 2025.” 	ghioceii, toporaşii, singurii, vestitori, primăverii
			
https://www.timesnewroman.ro/monden/nea-costel-actor-va-juca-in-blockbusterul-terminatorul-de-tuica/	Nea Costel, actor, va juca în blockbusterul Terminatorul de Ţuică	Cunoscutul actor român Nea Costel, celebru pentru filmele care i se derulează în cap când discută politică cu bețivii de la birtul de pe strada Cuza Vodă a finalizat negocierile cu Viacom pentru a apărea în noul film al francizei Terminator, Terminatorul de Țuică. Filmul îi va avea în distribuție și pe Arnold Schwarzenegger și Olivia Wilde.   În noul block-buster, Nea Costel interpretează rolul unui drojdier din anul 2021 în care omenirea este asuprită de roboți, care le spun ce să facă, ce să zică pe internet și cum să se comporte civilizat în societate, altfel riscă ban. Acesta se întoarce în trecut să se întâlnească cu el tânăr, pe vremea când era doar Bă Costel și să-l convingă pe acesta să se țină în continuare de băut că viitorul nu arată deloc luminos.Pentru asta, ajutat de robotul cu față uman interpretat de Arnold, trebuie să-l convingă pe Bă Costel să bea un butoi întreg de țuică înainte ca alți roboți din viitor, puși pe fapte bune, să-l oprească din acest gest și să-l convingă să ducă o viață de om sobru. Roboții viitorului vor să-l transforme pe Costel într-un corporatist decent, cu mapă, poză de profil pe Facebook de om serios, care duce mâna la tâmplă și pare că gândește, care se revoltează mediu cu privire la subiectele zilei și se îmbată doar în cadru organizat, la degustări de vin și se pișă pe pantaloni doar în UBER-ul care-l duce acasă. 	cunoscutul, actor, român, costel, celebru, pentru, filmele, derulează, când, discută, politică, bețivii, birtul, strada, vodă, finalizat, negocierile, viacom, apărea, francizei, terminator, terminatorul, Țuică, filmul, distribuție
			
https://www.timesnewroman.ro/monden/ue-interzice-tigarile-slim-ca-sa-nu-mai-aratam-ca-niste-fatalai/	UE interzice țigările slim, ca să nu mai arătăm ca niște fătălăi	Batjocura la adresa demnității umane este pe care să se încheie. UE a anunțat că va interzice țigările slim, celebrele obiecte a căror unică menire este să te facă să arăți ca ultimul fătălău. Noile norme europene vor avea standarde clare privind dimensiunea și grosimea țigărilor, astfel încât astfel de evenimente abominabile să nu se mai repete niciodată.   „De când au apărut țigările slim, apelativul fătălău efectiv a explodat“, spune europarlamentarul Pierre de Cebal, inițiatorul proiectului de interzicere. „Lumea a ajuns să fumeze cu teamă, din cauză că o țigară slim te face ridicol. De asemenea, nimeni nu și-a mai pus poze de profil în social media cu țigara, de frica comentariilor pe care le-ar primi.“O altă măsură, poate chiar mai benefică pentru fumători, pe care o pregătesc oficialii europeni este introducerea unor pedepse consistente pentru cei care fură brichete. „Începând de la amenzi de sute de euro, dar mergând chiar și până la un an de închisoare cu executare, în cazul celor care subtilizează mai mult de trei brichete într-o zi“, a anunțat Pierre de Cebal. 	batjocura, adresa, demnității, umane, încheie, anunțat, interzice, țigările, celebrele, obiecte, căror, unică, menire, facă, arăți, ultimul, fătălău, noile, norme, europene, standarde, clare, privind, dimensiunea, grosimea
			
https://www.timesnewroman.ro/monden/petrica-mitu-stoian-mesaj-pentru-doamne-de-8-martie-coace-doamne-prunele/	Petrică Mîţu Stoian, mesaj pentru doamne de 8 Martie: Coace, doamne, prunele!	Îndrăgitul interpret de muzică populară Petrică Mîţu Stoian n-avea cum să rămână singurul artist al ţării care n-a difuzat un mesaj pentru doamne de 8 Martie.   Întrebat de jurnaliştii Etno care e mesajul său pentru doamne, Mîţu a răspuns, ferm şi hotărât ca întotdeauna:„Coace, doamne, prunele!”După ce i s-a explicat că 8 Martie nu e ziua lui „doamne-doamne”, divinitatea cocătoare de prune, ci a doamnelor, deci ar trebui să transmită doamnelor un mesaj special, Petrică şi-a corectat imediat urarea, mieunând cu jumătate de gură: „Coace, doamnelor, prunele”.„Mie nu-mi sună bine da’ dacă aşa zice gramatica… Or fi schimbat ăştia DOOM-ul? Probabil, dar n-aveam de unde să ştiu, eram ocupat cu ţuica”, a adăugat artistul. „Important e să coacă cineva prunele şi anul ăsta.” 	Îndrăgitul, interpret, muzică, populară, petrică, mîţu, stoian, n-avea, rămână, singurul, artist, ţării, difuzat, mesaj, pentru, doamne, martieÎntrebat, jurnaliştii, mesajul, răspuns, hotărât, întotdeaunacoace, pruneledupă, explicat, martie
			
https://www.timesnewroman.ro/monden/ctp-sustine-ca-in-84-l-a-ridicat-militia-de-pe-strada-pentru-ca-avea-plete/	CTP susţine că în ’84 l-a ridicat Miliția de pe stradă pentru că avea plete	   În sfârşit, omenirea a aflat de ce e CTP atât de încrâncenat şi de furios tot timpul! În cea mai recentă emisiune a sa de la Digi 25, gazetarul a povestit cum, în toamna lui 1984, a fost săltat de Miliţie de pe stradă pentru că avea plete.„Aveam o coamă luxuriantă, de leu tânăr, şi un breton ca un stufăriş impenetrabil. Mergeam ţanţoş, cu părul în vânt, le zâmbeam tuturor, ah, eram aşa mândru de pletele mele angelice. Ăsta, Remus Cernea, ăsta era mic copil pe lângă mine! Nu eram bogat, dar aveam plete superbe şi nu-mi trebuia mai mult”, a povestit CTP, retrăind fiecare clipă de parcă ar fi fost în urmă cu doar şase ore şi 20 de minute. „Până în ziua aia fatidică, când, venind spre casă de la coafor, am decis să scurtez drumul printr-un gang, pe lângă Circa 10 de Miliţie”, „Într-o clipă, visul meu de a fi cel mai pletos om al generaţiei mele s-a năruit. Îmi aduc aminte şi acum rânjetul malefic al miliţianului. Căpitanul Marin parcă îl chema. M-a dus în beciul ăla, mi-a făcut un masaj capilar şi m-a tuns definitiv, atât de temeinic şi de vârtos încât de atunci îmi mai creşte un singur păr, nici nu vă zic unde”, a adaugat îndrăgitul critic de tenis, film şi în general critic de chestii.Înduioşaţi, mai mulţi telespectatori i-au oferit lui CTP diferite peruci sau chiar părul lor natural, însă gazetarul a precizat că îşi va purta în continuare chelia, cu stoicism, ca o amintire pieloasă şi gălbuie a fragilităţii existenţei umane. 	sfârşit, omenirea, aflat, atât, încrâncenat, furios, timpul, recentă, emisiune, gazetarul, povestit, toamna, săltat, miliţie, stradă, pentru, pleteaveam, coamă, luxuriantă, tânăr, breton, stufăriş, impenetrabil, mergeam, ţanţoş
			
https://www.timesnewroman.ro/life-death/muntele-athos-plin-de-pet-uri-de-apa-sfintita-lasate-de-pelerini/	Muntele Athos, plin de PET-uri de apă sfinţită lăsate de pelerini	Călugării din cel mai sacru loc al Greciei se plâng de o veritabilă bombă ecologică! Cele mai multe mănăstiri de pe Muntele Athos au decis să nu mai ofere apă sfinţită la PET după ce Poutsos Saganaki, pădurarul peninsulei, a constatat că pelerinii aruncă fără discernământ ambalajele nebiodegradabile, ducând la apariţia de mici mormane sfinţite care perturbă echilibrul întregii zone.   „Să zicem că sunt un pelerin şi cumpăr un PET de 3 litri de apă sfinţită ca să scot dracii din mine, da’ îmi ajung doi litri şi ceva pentru toţi dracii. Arunc ambalajul în pădure, nu? Poate nu l-am închis bine, şi toată apa aia sfinţită ajunge în mediul înconjurător, sfinţind buburuze şi alte goange, pe care ulterior le mănâncă păsările. Păsările sfinţite sunt mâncate de pisici, vulpi, lupi… cu ce ne alegem? Cu haite de lupi sfinţiţi, cu superputeri, care ne decimează turmele de capre prin rugăciune”, se plânge fratele Papastratos, stareţul mănăstirii Assos Lights.„Dacă mă întrebaţi pe mine, sfârşitul PET-ului e aproape. Urmează domnia de o mie de ani a dozatorului cu păhăruţe enervante de hârtie”, a profeţit un pustnic din apropiere. 	călugării, sacru, greciei, plâng, veritabilă, bombă, ecologică, multe, mănăstiri, muntele, athos, decis, ofere, sfinţită, după, poutsos, saganaki, pădurarul, peninsulei, constatat, pelerinii, aruncă, fără, discernământ, ambalajele
