url	title	body	keywords
https://neurococi.ro/posts/Elevii-au-concluzionat-scenariile-sunt-t	Elevii au concluzionat: scenariile sunt totuşi maro!	      Mai mulţi elevi care au studiat scenariile colorate au ajuns la conluzia că sunt de tot marou'. Şeful consiliului elevilor unui liceu de mate-fizică&rock'n'roll declară supărat: 'Acu, că începe şcoala ne-am uitat şi noi pe scenarii. Vai de capu nostru'! Celor de la minister le lipseşte în mod clar viziunea asupra ceea ce inseamnă actul educaţional. Păi unde e man Scenariul Roz? În scenariul roz ne putem pregăti cel mai bine, asta e clar! Exact ca în anii trecuţi: de la 08 la 14 în restaurante, baruri, cafenele şi localuri exact ca-n melodia populară...unde e respectul pentru tradiţii?'   	scenarii, incepe, scoala, baruri, cafenele, mate-fizica, consiliu, elevi, liceu
https://neurococi.ro/posts/Marele-Vistiernic-ar-semna-cu-Head-and-S	Marele Vistiernic ar semna cu 'Head and Shoulders' dar nu poate că suntem nesupuşi.	      Marele boier a prins azi tronu liber si a tunat către Marele Jude că fuge banu de la cetate daca-i lasa liberi pe unii care îndeamna pulimea la nesupunere. 'Românii trebuie să fie supuşi, unde ne trezim? Uite, săptămâna trecută, m-au sunat de la 'Wash&Go' şi-am stabilit că ne întâlnim azi ca să semnăm contractul pentru deschiderea în reactorul IV, atât de necesar economiei româneşti, a unui stand de şampon. Dar până au ajuns investitorii la mine în birou au văzut probabil cât de nesupuşi sunt românii, aşa că nici nu m-au salutat bine că au fugit înapoi la aeroport şi-au luat primul avion fără să întrebe măcar unde merge.'   	citu, boier, vistiernic, wash'go, sampon, reactor, jude, nesupunere, supus
https://neurococi.ro/posts/Rasturnare-de-situatie-Romania-este-cu-5	Răsturnare de situaţie: România este cu 50 de ani înaintea Germaniei!	      Deşi mult timp s-a crezut că filme ca 'Star Trek' sau 'Back to the Future', care au anticipat cu o suprinzătoare precizie descoperiri din domeniul tehnologiei, ne dezvăluie viitorul, cele mai recente cercetări arată că societatea se îndreaptă accelerat spre deznodământul sugerat în filmul 'Idiocracy'. Aceasta tendinţă plasează România pe locul 1 în topul ţărilor cele mai avansate, fiind cu cel puţin 50 de ani în faţa occidentului. Angela Merkel încearcă să calmeze populaţia: 'Putem ajunge din urmă România în următorii 10-15 ani, dar U.E. trebuie să legifereze mai mult!..sunt atâtea lucruri care mai pot fi interzise în interiorul Uniunii! ... noi germanii avem o veche tradiţie în pornografie aşa că avem de unde alege un preşedinte!... Schneller!.. Schneller!'   	germania, ue, merkel
https://neurococi.ro/posts/Ajutati-ne-sa-l-gasim-pe-colegul-nostru	Ajutaţi-ne să-l găsim pe colegul nostru.	      Suntem îngrijoraţi. E băiat bun, dar probabil e tulburat după sărbători, că a lăsat un bilet alarmant: 'Bă io mă fac popă că-i mai distractiv!' Soţia acestuia spune că a plecat de acasă cu o draperie, o cruce şi-o elice cu radiocomandă. Ne temem pentru viaţa lui pentru că ăsta habar n-are cum să umble cu crucea şi ne e frică să nu se taie în ea. Anul trecut, tot de bobotează, a mai avut o cădere psihică dar a fost prins la timp pe malul Dunării în timp ce antrena nişte credincioşi.   	cruce, popa, botez, neurococi, redactor, dunare, inot, boboteaza
https://neurococi.ro/posts/Pentru-ca-in-satul-Batrana-nu-este-inter/	Pentru că în satul Bătrâna nu este internet, sătenii s-au mobilizat şi şi-au făcut propria reţea Village Wide Web.	      Au auzit şi ei de Google, Facebook sau PornHub şi nu vor să se lase mai prejos aşa că s-au adunat, au luat nişte decizii, au facut nişte convenţii, s-au organizat, şi au realizat o reţea aproape la fel de bună ca originalul. Trei săteni care au Tohanuri lucrează pe 3 schimburi ca Google Search Pedal iar prin convenţie pietrele rotunde au primit statut de 'Like'. Vrei să cauţi ceva pe VWW? chemi Search Pedal-ul de servici şi-i zici: am nevoie de reţeta pentru Calamari la Piastra con Pesto de Busuioc. În maxim 20 minute Google dă o tură la babele pricepute în ale bucatăriei şi întoarce rezultatele. Sătenii postează în fiecare zi pe wall-ul casei citate din Paler, Shakespeare sau Guţă, dau share la bagaboanda satului, sau fac schimb de like-uri. Modulul PornHub este  insă cel mai apreciat, şi a şi fost foarte simplu de implementat: au hotărât ca în Batrâna să fie interzise draperiile dacă în casă locuieşte o femeie mai tânără de 99 de ani. De regulă, după ora 23, tot satu' este la fereastră la tanti Marieta, o prospătură din '51. Bineînţeles că nici satul Bătrâna nu a scăpat de problemele specifice unei reţele: Google-ul de servici întoarce frecvent câte un 404 (Not Found), pentru că, nu se ştie de ce, în Bătrâna oamenii se incăpăţânează ba să moară destul de des, ba să plece unde văd cu ochii. În urmă cu câteva zile s-au confruntat şi cu primul virus care a reuşit să pună un cearceaf pe geamul Marietei şi să-i umble la hardcore.   	internet, sat, pornhub
https://neurococi.ro/posts/Satul-de-ruta-Simeria-Calan-un-tren-a-pl	Sătul de ruta Simeria-Călan un tren a plecat la Bucureşti să se facă tramvai.	      Locomotivele din triajul Simeria sunt foarte mândre de tânărul tren cu un vagon care are aşa gânduri mari. 'Îl ştiu de când era uite-atâtica, noi ii spuneam Ceferest Gump că avea ceva probleme la roţi şi-l luau la mişto toate drezinele. Dar băiatu' ăsta a avut o ambiţie de invidiat şi a ajuns să fie cel mai rapid tren din depou. Cei 11 km pănă la Călan îi făcea în 34 minute. Am auzit că deja are barbă şi plete şi tot mai multe trenuri din ţară îl urmează. Acu' ce să zicem, noi îi ţinem pumnii şi sperăm ca până-n aprilie ajunge. Run, Ceferest, run!'   	cfr, gump, forrest, tramvai, bucuresti, locomotive, simeria, calan
https://neurococi.ro/posts/Orban-canta-de-o-saptamana-dar-nu-reuses	Orban cântă de o săptămână dar nu reuşeşte să întoarcă nici un scaun.	      Vocea României în impas. Deşi concurentul cântă de zile bune, şi pare că refuză sa iasă din scenă până nu întoarce şi el un scaun, antrenorii nu se supără ba chiar fac mişto de cântăreţ făcându-se din când în când că apasă pe buton. Pavel Bartoş nu poate interveni pentru că l-a ghidat pe Orban în parcare şi apoi a trebuit să plece să mănânce o supă cu paiu. Irina Rimes de la USR se amuză copios şi a concluzionat că-i aşa fain să cânţi că poate într-o bună zi o să se apuce şi ea, Smiley ţine ritmul mimând pe masă Ctrl C Ctrl V, Tudor e puţin nervos că Verestoy n-a apucat să taie copacul din care şi-a făcut Orban chitara iar Brenciu o aşteaptă pe următoarea Julie Dăncyaya.   	vocea, orban, pnl, bartos, smiley, chirila, brenciu, rimes, canta
https://neurococi.ro/posts/Studiu-2-din-3-romani-sunt-de-doua-ori-m/	Studiu: 2 din 3 români sunt de două ori mai mulţi decât ceilalţi!	      Studiul demografic comandat de neurococi.ro mai arată că un român din 15 e ungur şi un român din 1930 e bătrân.   	studiu, demografic, roman, ungur, batran
https://neurococi.ro/posts/Reducerea-poluarii-repara-pamantul-Arsen/	Reducerea poluării repară pământul. Arsenie Boca a apărut pe site-ul neurococi.	      Dragi cititori, stimată adunare, fraţi creştini. Iată că reducerea poluării aduce lumină în sufletele noastre, repară pământul şi alungă toate relele. Ne cerem scuze că am păcătuit făcând mişto de tot felul de oameni şi de Cîţu. Atenţie însă dragi enoriaşi, lupta cu cel rău nu este încă desăvârşită! Unele secţiuni ale site-ului nu îl afişează încă pe domnul părinte Arsenie_Boca.jpg iar unii redactori întind încă mâna după bere. Rugaţi-vă prieteni ca efortul nostru, al oamenilor buni şi cu frică de Dumnezeu, să nu fie zădărnicit de o slabă capitalizare a site-ului iar lupta noastră să fi fost în zadar. Avem următorul mesaj de la sfinţia sa redactorul şef: RO66CECEB666666EUR666669. Amin!   	prislop, arsenie, boca, poluare, reapara, pamant, crestini, satira
https://neurococi.ro/posts/Sarpele-cu-cap-de-lup-era-de-fapt-un-lup	Şarpele cu cap de lup era de fapt un lup cu cur de şarpe.	      Istoricii au dat verdictul după ce au observat că toate steagurile dacice găsite erau cu capul spre Orăştie. Şeful catedrei de Istorie Aplicată al unei prestigioase universităţi mehedinţene ne explică concluziile: 'Până acum se credea că steagul dacic avea un design menit să înfricoşeze adversarii de cetăţenie romană care venau din faţă. Greşit! Se pare că dacii doar voiau să le sugereze vestiţilor poponari romani care veneau din spate, să-i lase-n pace, că n-are rost să fugă după ei că oricum şi dacă i-ar prinde tot n-ar putea să le-o dea la buci.'   	lup, sarpe, daci, romani, poponari, ymca, buci, steag, orastie
https://neurococi.ro/posts/Daca-PNL-ar-produce-Salam-de-Vara-acesta	Dacă PNL ar produce Salam de Vară acesta ar purta fular şi căciulă.	      Entertainerii Orban (vornic PNL), Blaga (iluzionist PDL) şi Rareş B. (clovn de Cluj) ne-au prezentat lista cu ingredientele pregătite pentru concursul de cârnaţi ai Parlamentului European. Cu toate că fanii PNL aşteptau să fie ceva de-un salam de Sibiu, sau măcar de unu' săsesc, iată că lista cuprinde doar aceleaşi ingrediente folosite şi la fabricarea Parizerului Social Democrat. Mulţi liberali dezamăgiţi au ajuns să se bazeze pe cârnăciorul lui Cioloş, făcut tot din porci şi şorici gros, dar cu condimente franceze, membrană germană şi, pe post de sfoară, cablu de microfon.   	pnl, salam, parlament european, orban, blaga, rares bogdan
https://neurococi.ro/posts/Sumerienii-au-lansat-un-update-pentru-po	Sumerienii au lansat un update pentru posesorii de tablete cuneiforme.	      Cel mai aşteptat update din istorie a fost lansat recent şi a provocat un val de reacţii! Tabletele cu scriere cuneiformă au fost foarte la modă în urmă cu doar câteva mii de ani dar fiind făcute de o firmă de stat nu au avut beneficiat de nici un update de soft până în acest moment. Numai utilizatorii avansaţi puteau lucra cu ele, fiind considerate practic prima versiune a sistemului UNIX. Bunicile şi utilizatorii obişnuiţi nu puteau să acceseze prea multe informaţii cu acestea, iar pornachele era un vis chiar şi pentru cei mai avansaţi hackeri. Un utilizator entuziast ne dă amănunte: 'Familia mea aşteaptă de 4.000 de ani acest update. Am înţeles că încă nu vom putea intra cu ea pe Facebook, dar măcar au băgat şi ei 2 fonturi ca lumea: Times New Roman şi Comic sans J.C.. Abia aştept să descopăr noi informaţii pe tabletă. Acum e cu installu' pe la 5% ca sunt 2 fisiere mari de downloadat, vă daţi seama. Sper să mă ţină bateria la lanternă s-o pot citi la noapte.' Un alt utilizator continuă: 'Dă-i în plm de sumerieni! Io am terminat update-ul şi acu' de-abia se mişcă...măcar înainte aveam o imagine clară cu nişte cuie, dar acu am lag parcă mai mare, deşi FPS-ul e tot zero. Nişte m*işti. E clar că vor să ne determine să ne luăm altele, că nu-i mai satură zeii!'   	sumerieni, cuneiform, scriere, fonturi, tablete, unix, hackeri, update, soft
https://neurococi.ro/posts/UE-ne-mai-da-o-bucata-Ce-n-ai-voie-la-bu	UE ne mai dă o bucată! Ce n-ai voie la bucată!	      După ţigările la bucată, iată că mintea întortocheată a bunicuţei UE interzice şi pastilele la bucată. În general UE are ca ţintă organizarea bucăţilor mai mici în bucăţi mai mari care vor căpăta statutul de Pachet. Deşi în farmacii nu mai poţi comanda 2 pastile de Paracetamol, puteţi folosi o formulare nouă, în concordanţă cu cerinţele UE: '-Daţi-mi vă rog o pereche de Paracetamol!' sau, dacă doriţi numai o pastilă: '-Un pachet de 500mg de paracetamol vă rog!' Din partea unor conaţionali au venit şi următoarele propuneri: Un europarlamentar a cerut şi interzicerea vânzării la bucată a pachetelor care nu conţin bucaţi, dar propunerea Monicăi a fost respinsă pentru moment. Un anonim, în cadrul dezbaterii publice, a cerut şi interzicerea K.O.-ului dintr-o bucată.    	ue, bucata
https://neurococi.ro/posts/Moldova-nu-se-lasa-mai-prejos-Iasiul-va-	Moldova nu se lasă mai prejos! Iaşiul va găzdui festivalul Nobodylisten!	      Nu putea să lase toată pita-n Cluj şi-n Constanţa. După festivalurile nespuse sau nemaivăzute se lansează în sfârşit şi festivalul la care nimeni nu ascultă muzică, dar măcar este marketat corect.   	untold, neversea, festival, cluj, iasi
https://neurococi.ro/posts/Pentru-ca-Ursul-de-Aur-nu-era-de-ajuns-a	Pentru că Ursul de Aur nu era de ajuns, a apărut Eurovisionul.	      Hai c-am glumit! Eurovisionul a apărut pentru că nemţii, danezii (probably the best singers in the world), elveţienii sau finlandezii trebuiau şi ei să cânte pe undeva. Era păcat ca restul omenirii să nu audă cum se cântă şirurile de consoane care încântau audienţa la nunţile nordicilor sau germanicilor. Lumini, efecte şi femei cu barbă se combină armonios cu zgomotul de ferăstrău umilind de-a lungul timpului trupe de amatori ca Led Zeppelin, Pink Floyd sau Queen. Deşi românii nu s-au lăsat mai prejos şi au trimis şi ei pe scenă o femeie cu barbă, Cezar Ouatu nu a înţeles spiritul competiţiei, şi nu a reuşit să cânte nici măcar o singură consoană, oripilând audienţa din Europa civilizată cu triluri de a, e, i, o, u, ă, â. Mihaiţă a fost cel mai aproape de efectul de ferăstrău, dar Europa nu era pregătită să treacă la flex în domeniul muzical. Eurovision se remarcă prin faptul ca participanţii trebuie să aiba o memorie extraordinara pentru a reţine linia melodică a pieselor pe care le interpetează. La ediţiile de dupa 2002, dacă asculţi cu atenţie, ai impresia ca auzi câteva piese în limba engleză. E prima dată când regretăm că nu ne uităm la Eurovision că am putea umple zeci de pagini.     	eurovision, ursul de aur
https://neurococi.ro/posts/Caderi-de-pietre-la-Cotroceni-in-urma-pl	Căderi de pietre la Cotroceni în urma ploilor din această primăvară.	      Ca în fiecare an topirea zăpezi, dublată de ploile de primăvară, determină căderi de pietre pe Valea Oltului şi la Cotroceni. Bolovanul purtat pe umeri de Iohannis se sfarmă încet-încet pe culoarele Cotroceniului, traficul pietonal desfăşurându-se cu dificultate din cauza dârelor de nisip şi pietriş. Noroc cu anomalia spaţiu-timp din jurul bolovanului care face ca acceleraţia gravitaţională din proximitate să fie de doar 2 m/s² astfel încât apropiaţii au timp să se ferească de pietrele ce cad de la cei 2 metri de preşedinte.   	iohannis, bolovani, cotroceni, ploi
https://neurococi.ro/posts/Pfizer-anunta-o-eficienta-de-198-dupa-ce/	Pfizer anunţă o eficienţă de 198%, după ce a făcut un ac de 1 metru.	      Practic cu seringa brevetată de Pfizer pot fi vaccinaţi 2 pacienţi cu o singură doză. La nici 2 ore de la anunţ, compania Gamaleya clamează o eficienţă de 399% a vaccinului Sputnik-V înzestrat acum cu un ac de 2m cu care pot fi injectaţi simultan 4 pacienţi cu o singură doză. C.E.O.-ul Moderna a fost văzut cărând un ac de 3 metri deci este posibil ca recordul Sputnik-V să nu reziste până îţi faci o cafea. AstraZeneca, rămasă cu seringa mică, anunţă că oricum vaccinul lor e şi mai bun, că nu contează cât de mare o ai, ci cum o foloseşti: Pascal Soriot, CEO-ul AstraZeneca pentru neurococi: 'Datele furnizate de competitori sunt denaturate. După primul pacient acul se blegeşte şi nu poate penetra pacientul următor. Din acest motiv departamentul nostru de design a realizat cea mai jucăuşa seringă, aşa că ne facem treaba cu ea.'   	vaccin, pfizer, sputnik-v, astrazeneca, moderna, seringa, ac, jucausa, ceo, pacienti, efic
https://neurococi.ro/posts/Codul-bunelor-maniere-Eticheta-la-restau	Codul bunelor maniere. Eticheta la restaurant. Capitolul 1. Ciorba cu păr.	      - Nu vă supăraţi! Îmi aduceţi vă rog un pieptăn!...da, da...vreau să-mi pieptăn puţin ciorba că e cam ciufulită! - Din olivieră lipseşte ceva! Şamponul! - Vă supăraţi dacă îndoi cuţitul? Am nevoie de-o agrafă! - Ciorba asta e cam rece! S-a stricat feonul? - Vai ce drăguţă e! Muşcă? - Flocii îi primim la felu' doi? - Lipseşte o solniţă! Pe aia cu piper o văd, da' unde-i aia cu mătreaţă? - O mai încălziţi puţin?...mi-e frică să nu racească cum stă aşa cu parul ud. - Cred că o iau la pachet. Puneţi-o vă rog într-o căciulă. - Bravo! Ciorba asta e Breton!   	restaurant, ciorba, eticheta, par
https://neurococi.ro/posts/Pentru-ca-Smiley-canta-din-ce-in-ce-mai-	Pentru că Smiley cântă din ce în ce mai bine va fi cooptat în trupa Taxi.	      Dan Teodorescu, fondatorul trupei Taxi, despre decizia de cooptare: 'Lista de aşteptare pentru a prinde un loc în formaţia Taxi are 5 metri. Pentru că suntem extrem de selectivi, doar cântăreţii maturi pot completa declaraţia unică de adeziune la trupă, pentru a fi admişi la interviu. Domnul Smiley a trecut cu bine de interviu deşi i-am adresat cele mai grele întrebări. De exemplu a reuşit să interpreteze melodia La La La, Tra-La La în Si bemol şi a reuşit să compună o melodie pe care o uiţi în timp ce-o cânţi adică exact acel chelcheşoz care face trupa Taxi atât de iubită. La proba eliminatorie de executare a arpegiilor a trecut cu brio demonstrând că este capabil să facă arpegii sau să cânte o gamă folosind o singură notă. Daca nu-şi pierdea buletinul era deja de azi membru al trupei dar aşa trebuie să aducă un certificat de naştere pe care să scrie clar Smiley ca să putem să-l întabulăm.' O informaţie de pe surse spune că primul album în noua formulă va apărea săptămâna viitoare şi va purta numele 'Eşti iubibilă la ora asta?', probabil un album porno în care să poţi să-ţi bagi p*la.   	taxi, smiley, album, muzica, nota, teodorescu, afon
https://neurococi.ro/posts/Mai-multi-brazi-au-fost-vazuti-iesind-di	Mai mulţi brazi au fost văzuţi ieşind din sediul PMP.	      Pentru că se apropie sărbătorile PMP se gândeşte la tradiţii şi a expediat astăzi spre destinaţii necunoscute mai mulţi brazi gata decoraţi cu globuri şi embleme militare. Unul dintre brazi s-a întors la scurt timp c-o sticlă de kefir Daniel's Old No 7, semn că Băsescu e în sediu şi se pregăteşte să sărbătorească cu o lăptăreasă.   	pmp, base, sri, brazi, sediu, jack, kefir, laptareasa, sarbatori
https://neurococi.ro/posts/Mai-multe-perechi-de-tate-gasite-sub-las/	Mai multe perechi de ţâţe găsite sub laserul de la Măgurele.	      Zeci de ţâţe găsite pe jos de femeia de servici a Centrului Integrat de Tehnologii Avansate cu Laser de la Măgurele au dat de gol faptul că angajaţii centrului au chefuit in noaptea de Revelion. 'Nu ma pot maică, după fiecare petrecere de firmă adun ţâţe de pe jos. Toate femeile din Centru se fac rangă şi se apucă de Limbo pe sub fascicul. Nu înţeleg cum nişte duamne cu multă şcoală aleg să facă Limbo pe sub laser. Şi io mai beau la servici dar fac Limbo pe sub pula lui Marcel de la pază.'   	limbo, laser, magurele, ţâţe, femei, servici, centru, angajati, petrecere, chef
https://neurococi.ro/posts/Guvernul-va-repara-si-liftul-din-Big-Ban	Guvernul va repara şi liftul din Big Bang Theory.	      În preambulul şedintei de guvern de astăzi, în faza de pasat lozinci şi gânduri mari presei, s-a stabilit ca imediat după darea în folosinţă a liniei M5 guvernul să-şi concentreze eforturile pe liftul din Big Bang Theory. 'În 1 Iunie la ora 12 dăm drumu' la M5, şi mai pe seară ne-apucăm serios de treaba cu liftu' ăla. În primă fază vom aloca 1% din PIB pentru studiul de fezabilitate, şi apoi aşteptăm să vedem ce pretenţii au ONG-urile care stau pe scară cu Sheldon.'   	sheldon, orban, guvern, m5, metrou, lift, big, bang, fezabilitate, ong
https://neurococi.ro/posts/Daca-isi-revine-economia-frizerul-lui-Ci	Dacă îşi revine economia frizerul lui Cîţu o să-şi cumpere foarfecă.	      Cel mai bucuros pentru nominalizarea lui Cîţu la funcţia de premier este frizerul său. 'În sfârşit noi, investitorii, vom putea să ne retehnologizăm. Am toată încrederea în domnul Cîţu pe care îl tund de când avea păr şi îi ştiu pretenţiile: smulg mai mult din faţă şi din dreapta sus, pe laterale numai puţin, iar pe la spate îl pârlesc. Dacă ajunge domnia sa Prim-ministru e clar că o să curgă cu caşflou şi o să-mi pot îndeplini visul meu de-o viaţă: să-mi iau o foarfecă şi să-mi plombez dinţii la pieptăn. Atunci o să pot să mă dezlănţui şi Cîţu va arăta ca un adevărat om de stat: ca Boris sau Trump.'   	cîţu, premier, nominalizat, investitori, frizer, boris, trump, prim-ministru1
https://neurococi.ro/posts/Romanul-care-va-ramane-singur-singurel-i	Românul care va rămâne singur-singurel in ţară a împlit astăzi 12 ani. Acesta a conceput deja planul de apărare stabilind judetele in care va turna lipici, unde va pune penele, si unde va construi o autostradă.	      Îl cheama Chevin, e blond, si e ultimul român care va ramane in tara cu greaua misiune de a o proteja de singurii 2 fraieri care vor sa intre. Spune ca cel mai greu i-ar fi sa transporte penele la Constanţa asa ca, imediat dupa ce-l va duce la gara pe tatăl sau (penultimul român), o sa faca autostrada. Planul lui incepe defensiv cu un complicat sistem cu un scripete care mişcă braţul unui manechin care sta la masa si bea astfel incat totul să pară normal. In boxe va răsuna 'S-o suit Pişta pe cal..' astfel încât Joe Pesci sa creadă că e Florin Piersic acasă. şi 'Nedves Banditák' (a.k.a Wet Bandits) să stea pe şaua lor. Din pacate discursurile lui Iohannis (singurele inregistrari care pot reduce pulsul ascultatorilor la zero) vor fi pierdute până atunci si va trebui sa se apere prin metodele clasice. Facem un apel pentru toti românii care urmeaza sa plece: Măi băieţi cănd plecati de acasa lasati pianul sus pe scari si legati-l cu aţă de clanţă. Baftă Chevin!   	kevin, home alone, romania, ultimul roman, chevin, 12 ani, judete
https://neurococi.ro/posts/SRI-recunoaste-ca-muraturile-de-anul-ast	SRI recunoaşte că murăturile de anul ăsta au ieşit cam moi.	      Comunicat SRI: 'Orice gospodină mai dă rateuri când vine vorba de zacuscă sau murături. Dacă n-ai instrucţiuni clare, dintr-o singură sursă, ori pui prea multă sare, ori prea puţine microfoane, ori dosare cu şina oxidată. Unii spuneau că de vină e conopida proastă dar, după cum puteţi vedea pe asta nici n-am pus-o în borcan. Ne pare rău dar după alegeri vom tăia nişte surse şi vom nota reţeta pe butoi astfel încât vă promitem că peste 5 ani o să puteţi să ne mâncaţi castravetele. Până atunci asta e, îl mestecaţi puţin şi scuipaţi.'   	sri, iohannis, dancila, barna, comunicat, muraturi
https://neurococi.ro/posts/Sute-de-romani-au-dat-navala-in-centru-v	Sute de români au dat năvală în centru vechi după ce au auzit că se bagă CoronaVirus gratis.	      Un zvon pornit din adâncurile facebook a făcut ca sute de români sa ia cu asalt localurile din centrul vechi ai capitalei în speranţa că vor putea savura gratuit din primul lot de CoronaVirus care trebuie să ajungă dintr-un moment în altul în România. Aceştia şi-au pudrat nasul cu sare şi şi-au înfipt lime în nări, pentru o experienţă completă. Un client a cărui voce seamănă izbitor cu cea a lui Adam Sandler ne mărturiseşte: 'Aştept promoţia! Mi-am adus şi lămâie de-acasă în caz că se termină iar lime-ul din local. Desperadosu' ăsta l-am luat numa' ca să-mi încălzesc mâinile şi să am şi io ceva pe masă.'   	coronavirus, centrul vechi, local, desperados, adam sandler, lime, sare, bere
https://neurococi.ro/posts/Totul-a-fost-de-ochii-lumii-Greta-Thunbe	Totul a fost de ochii lumii: Greta Thunberg expiră dioxid de carbon!	      După scandalul Volkswagen (care măsluia testele de emisii de monoxid de carbon) iată ca o nouă dezvăluire aruncă în aer tot ce se ştia despre Greta Bioenergeta. Deşi monoxidul de carbon este mai toxic, dioxidul de carbon este cel vinovat de încălzirea globală. Nu putem decât să ne arătăm profund dezamăgiţi de poluanta Greta despre care toată lumea credea că are branhii în spatele codiţelor. Specialiştii au concluzionat: 'Ne aşteptăm la ce e mai rău: este posibil ca domnişoara Greta să tragă chiar şi pârţuri!'   	greta, bioenergeta, dioxid, carbon, globala, incalzire, part, volkswagen, poluare
https://neurococi.ro/posts/Apa-rece-strange-puta/	Apa rece strânge puţa	      Alaska -miscarea 'Baptism by Ice' incearca sa stranga fonduri pentru scopuri nobile....nu stim cat reusesc sa stranga dar putem face un calcul simplu: 5000 paricipanti (de la prima editie) inmultit cu:10 cm ( punem o medie de 10 cm ca sa dea rotund), vine cam 500 m de puţă stransă!..nu-i rau..unele muncesc o viata pentru asa ceva    	puta mica, ong, rece, frig
