url	title	body	keywords
https://neurococi.ro/posts/Un-Coronavirus-care-incerca-sa-intre-in-	Un Coronavirus care încerca să intre în România, 'anihilat' de un Bascovirus în Vama Borş.	      Un turist a suprins cu microscopul întreaga scenă şi ne-a oferit câteva fotografii. Majoritatea sunt marcate 18+ şi nu putem să le difuzăm, dar în imagini se vede clar cum Bascovirusul autohton îl anihilează pe alteţa sa în mai multe poziţii, arzându-l până acesta a cedat şi s-a întors crăcănat dar zâmbitor în Ungaria în uralele mai multor Şapcoviruşi. Dragoş Cinsticel, vameş, relatează: 'Am mirosit io că cineva vrea să intre în România fără să mă facă fericit, şi-am tuşit. Nu lucrez de ieri în vamă, cu mine nu mere nici o şmecherie! Am Bascoviruşi de la un control din '94, când am anihilat, într-un autocar, o reţea de ukrainience venită să ne dea balet!'   	coronavirus, bors, vames, bascovirus, ungaria, vama, microscop
https://neurococi.ro/posts/Iohannis-a-angajat-niste-serpasi-ca-sa-a/	Iohannis a angajat nişte şerpaşi ca să ajungă să înfigă steagul pe-un triftong.	      Şerpaşul şef, Lakpa Rita, declară pentru neurococi: 'Clientul meu ar putea rosti cu o singură mână zeci de triftongi înşiruiţi dar rămâne fără oxigen. Este ceva normal pentru o persoana care nu e obişnuită cu vitregiile triftongilor. Mai stăm câteva săptămâni în base camp unde domnul preşedinte se antrenează cu diftongi, apoi îi pun masca de oxigen şi o pornim către obiectiv că mai am şi altă treabă. Ca să-l motivez şi mai tare, i-am spus că la cota 7500 e un compatriot de-al dânsului, chiar din Sibiu, care stă acolo de 12 ani si vinde brânză.'   	triftong, şerpaş, iohannis, everest, lakpa, diftongi, triftongi, discurs, oxigen
https://neurococi.ro/posts/Evolutie-sub-ochii-nostri	Evoluţie sub ochii noştri!	      Fenomen extraordinar la #Ovidiu (Constanţa). La mai puţin de 3 luni de la inaugurarea statuii lui Ovidiu, realizată în întregime din piatră albă, porumbeii din zonă au început să se cace negru. Autorităţile căutau disperate soluţii pentru această problemă dar ajutorul a venit de unde se aşteptau mai puţin. Primarul Timişoarei, Nicolae Robu, cunoscut publicului larg din România pentru expertiza lui cu zebre, papagali şi ciori, a venit cu un plan simplu, în doi paşi:  1. Se vor pune anticoncepţionale în grăunţe, deci în câteva luni porumbeilor le vor creşte sânii.  2. Se va pune silicon în grăunţe, sânii porumbeilor vor creşte şi mai mult, şi, nu-i aşa, unde aţi mai văzut voi zburând  păsărici cu ţâţe mari?   	ovidiu, porumbei, evolutie
https://neurococi.ro/posts/obiceiuri-de-revelion	Obiceiuri de Revelion	      Dezavantaj: nu poţi să bei până te p*şi pe tine   	revelion, elastic, chiloti
https://neurococi.ro/posts/Vecinii-lui-Raed-Arafat-se-plang-ca-nu-p/	Vecinii lui Raed Arafat se plâng că nu pot să doarmă noaptea din cauza fluieratului.	      'Nu ştim ce s-a întâmplat cu domnul Arafat...de câteva zile fluieră şi se uită în sus ca şi cum ar purta o căciulă imaginară pe care stă o muscă, bineînţeles, virtuală! Era un tip foarte vesel şi punea umărul la problemele asociaţiei. Numai anu' ăsta a schimbat de 3 ori softul la lift şi ne-a făcut interfon în cloud. Vecinii lui de la apartamentele 111 şi 113 se plâng că nu mai pot dormi noaptea, din cauza unui fluierat cu accent arăbesc care răzbate din apartament'*Nota Administratorului: În 2018 Raed Arafat lipea la Avizierul Oficial următorul anunţ: 'Performanţele SNUAU (Sistemul Naţional Unic pentru Apeluri de Urgenţă) sunt recunoscute la nivel european.'   	Raed, Arafat, 112 
https://neurococi.ro/posts/Serviciile-celui-mai-temut-interlop-din-/	Serviciile celui mai temut interlop din Cluj, solicitate de mafia timişoreană:	      'E ziua micuţului Baygon von Raid Superkil, face 9 ani să merge şi el la şcoală, şi i-am promis că-i aducem un clovn. O să se opreşte puţin circulaţia că avem o inţelegere la primărie cu domnu' Bobu, care ne-a înţeles şi ne-a dat autorizaţea, noi am mulţămit frumos, şi i-am lăsat amintire cleştele de falange. Am atârnat toţi popii din Catedrală frumos de clopot, că o să facem un grătar acolo şi dă bine la dizain, să fie frumos. Puteţi veni şi dumneatale, da' să-ţi aduci şi-un sac cu fermuar' in caz că se încinge atmosfera.' .. parcă acestea au fost cuvintele purtătorului de cuvânt al famigliei timişorene, nu mai ştim foarte exact, că bateriile din reportofon s-au căcat pe ele.   	cluj, interlop, timisoara, robu
https://neurococi.ro/posts/Trump-are-o-idee-si-mai-buna-Sa-inghitim/	Trump are o idee şi mai bună! Să înghiţim capcane miniaturizate.	      După ce a dat o mână de ajutor comunităţii ştiinţifice cu ideile lui despre folosirea dezinfectanţilor sau a ultravioletelor de uz intern , Trump a mai venit cu o idee! General Motors va trece la construcţia unor capcane de şobolani, cu lăţimea de 1mm, care pot captura, la o singură declanşare, până la 1 milion de viruşi, dacă stau aliniaţi unul lângă altul, ignorând distanţarea socială, şi dacă momeala nu este caşcaval Delaco. 'Think about it! G.M. are destulă sârmă să facă miliarde de astfel de capcane. În ceea ce priveşte asigurarea momelii pe acest an, România a răspuns deja cererii noastre, şi cowboy Ghiţă ne va livra necesarul de caşcaval dat pe răzătoarea de 1nm, cam 20 mg.'   	trump, capcane, covid, coronavirus, dezinfectant, ultraviolete, gm
https://neurococi.ro/posts/Veniti-de-luati-luminaaa/	Veniţi de luaţi luminăăă!	      Toohappy Knopfler   	bor, preafericitul
https://neurococi.ro/posts/Mii-de-elevi-dezamagiti-Desi-au-impodobi	Mii de elevi dezamăgiţi! Deşi au împodobit astăzi bradu', Bacul nu a trecut pe la ei.	      'Mai dă-o-n plm...am făcut tot ce era omeneşte posibil: am scos bradu din beci, am băgat Hruşti în boxe că na, azi e zi mare...şi ciu-ciu n-a venit nimeni...sper totuşi să nu figurez absent că fac contestaţie...s-au mai văzut cazuri în anii trecuţi când au fost elevi notaţi absenţi şi la contestaţie au luat 9,50...asta e..Ministerul Învaţământului îşi bate şi în acest an joc de noi!'   	bac, invatamant, craciun, brad
https://neurococi.ro/posts/Antena-5G-din-Galati-a-suferit-o-mutatie/	Antena 5G din Galaţi a suferit o mutaţie şi acum produce cutremure.	      Din păcate, temerea cea mai mare a specialiştilor români privind antenele 5G, s-a confirmat. Antena 5G instalată la Galaţi a suferit o mutaţie şi a trecut de la producerea de nCoV la cea de cutremure. Angajatul RDS care a provocat mutaţia povesteşte: 'M-a trimis şefu' să rotesc puţin antena. Ştiam că e periculos, aşa că m-am dus echipat corespunzător cu mască de gaze şi costum de cosmonaut. Am urcat foarte greu pe stâlp că mă jenau îngrozitor chiloţii de tablă dar am reuşit să ajung la antena. În timp ce i-am slăbit şuruburile cred că s-a mutat puţin mai la stânga şi exact atunci s-a produs cutremurul. Acum nu ştim ce să facem. S-o lăsăm aşa să bage cutremure sau s-o mai mutăm puţin câte puţin până produce ouă, lână, lapte, brânză?'   	5g, antena, coronavirus, mutatie, cutremur, galati, digi, rds
https://neurococi.ro/posts/Guvernul-va-repara-si-liftul-din-Big-Ban/	Guvernul va repara şi liftul din Big Bang Theory.	      În preambulul şedintei de guvern de astăzi, în faza de pasat lozinci şi gânduri mari presei, s-a stabilit ca imediat după darea în folosinţă a liniei M5 guvernul să-şi concentreze eforturile pe liftul din Big Bang Theory. 'În 1 Iunie la ora 12 dăm drumu' la M5, şi mai pe seară ne-apucăm serios de treaba cu liftu' ăla. În primă fază vom aloca 1% din PIB pentru studiul de fezabilitate, şi apoi aşteptăm să vedem ce pretenţii au ONG-urile care stau pe scară cu Sheldon.'   	sheldon, orban, guvern, m5, metrou, lift, big, bang, fezabilitate, ong
https://neurococi.ro/posts/Cum-te-intorci-cu-spatele-cum-iti-da-cad/	Cum te întorci cu spatele, cum îţi dă cadoul!	      Anu' ăsta iepuraşu îţi pune cadou' sub brad, pe masă... peste tot!   	iepuraş, paşte, cadou, cadouri, 2020
https://neurococi.ro/posts/Primii-observatori-au-ajuns-deja-in-sect/	Primii observatori au ajuns deja în secţii.	      Observatorii PNL şi PSD s-au instalat deja în secţiile de vot hotărâţi să blocheze orice tentativă de fraudare a alegerilor. Aceştia par mai vigilenţi ca niciodată, pur şi simplu zici că-s vii.   	alegeri, vot, observatori, urne, umplut, electoral, saci, pnl, psd
https://neurococi.ro/posts/O-gloata-de-sefi-de-tari-s-a-reunit-la-L	O gloată de şefi de ţări s-a reunit la Londra să stabilească cum ne-o mai trag.	      Deşi toată presa vorbeşte la superlativ despre recepţia extraordinară de la Palatul Buckingham, în care mai mulţi şefi de stat s-au intâlnit la o recepţie informală, trimisul neurococi la cheful reginei relatează: 'Nu ştiu ce scriu ziarele. Io n-am văzut decât o grămadă de şefozauri care stăteau pe budă şi-o nemţoaică goală! Nici io nu-mi explic! Când am plecat, colegii mi-au recomandat ca, daca mă simt timorat, să nu-mi fac probleme: să mi-i imaginez stând pe budă sau goi. Da io n-am fost timorat deloc. Chiar aşa stăteau toţi. Jur!'   	regina, sefi, state, palat, buda, buckingham, reporter
https://neurococi.ro/posts/Scartiie-articulatiile/	Scârţâie articulaţiile?	      Căpitanul Data a fost primul care a descoperit că diclofenacul, sau  tratamentele naturiste, pur şi simplu nu funcţionează. Deşi doamna Data îl întreba întotdeauna când se întorcea din hiperspaţiu 'Ai luat Supramax Articulaţii?', capitanul s-a ţinut tare şi nu a pus botul la toate tâmpeniile căpităniţei. Spre sfârşitul bateriei, Căpitanul a făcut o descoperire uitmitoare: Problemele de articulaţii dispăreau ca prin farmec atunci când, domnişoara Fan, care-i mai tura din când în când cooleru', îl şpreia cu WD40, dintr-un flacon albastru. Căpitanul pur şi simplu putea să dea din cur ca-n tinereţea mătuşii sale, Ileana, maşina de cusut. De aici, şi până ca elita mondială să afle despre tratamentul minune nu a mai fost decât un pas: Mark Zuckerberg, uitându-se la activitatea căpitanului Data pe fast forward, a remarcat imediat efectele miraculoase ale WD40 asupra articulaţiilor aşa că şi-a cumpărat câteva petroliere de WD40 şi acum poate să dea din barbă făra asistenţa laboratorului Dolby.   	wd40, diclofenac, iohannis, zuckerberg, data, robot, voltaren
https://neurococi.ro/posts/Experimentul-Large-Train-Collider-Ploies/	Experimentul Large Train Collider Ploieşti un succes! Bosonul Ler observat pentru prima dată.	      Puţini ştiu că aşa-zisul 'accident' de la Ploieşti a fost de fapt un experiment CFRN menit să demonstreze existenţa bosonului Ler, un boson dacic, net superior bosonului Higgs. Deşi bosonul a fost stabil doar câteva fracţiuni de secundă şi a dispărut înainte ca naşul să apuce să-i ceară 50 lei împrumut, oamenii de ştiinţă au concluzionat cu un grad de certitudine de 99,9999% că este vorba de legendarul boson autohton. '99,9999% e destul de bine. Totuşi nu putem fi 100% siguri. Timpul de observare a fost prea scurt. Dacă avea timp să-şi ia o bere pe caiet atunci da.. ar fi fost in mod cert el! Acesta a fost doar primul dintr-un lung şir de experimente programate dar nu vă putem da mai multe amanunte pentru că e secret. Tot ce vă putem spune, fără să vă indicăm locaţia, este că în următorul experiment vom încerca să obţinem o viteză de impact mult mai mare şi asta nu se poate altfel decât prabuşind un pod, logic!'.   	boson, ler, cfr, cern, collider, geneva, ploieşti, tren, accident
https://neurococi.ro/posts/Intalnire-emotionanta-Jabba-The-Hutt-si-	Întâlnire emoţionantă. Jabba The Hutt şi-a regăsit fratele pierdut.	      Cu ochii plini de lacrimi Jabba The Hutt s-a afişat astăzi pentru prima dată împreună cu fratele său geamăn de care s-a desparţit de mult, într-o galaxie îndepărtată. 'Ce să fac...ştiu c-a ajuns să arate ca o reptilă respingătoare, dar e fratele meu şi ţin la el şi aşa. A avut o viaţă grea sărmanul, în timp ce io mă distram cu prinţesa Leia şi-l trimiteam pe Chewbacca să-mi ia ţigări, el era şofer la Jedi Cosma'   	gabriel oprea, jabba, star wars, frate
https://neurococi.ro/posts/Prima-persoana-pe-care-CTP-a-criticat-o-/	Prima persoana pe care CTP a criticat-o aspru a fost mama sa, şi asta în momentul în care l-a născut.	      Cu bustuleţul, o mânuţă şi picioruşele încă la căldurică CTP a lansat o serie de critici agresive către doamna Popescu şi personalul medical: 'Ce-i asta femeie? La asta-i zici tu naştere?!? .. concentrează-te, împinge...bagă zeamă! ..şi tu ce stai ca proasta? ..eşti moaşă sau fotograf..trage mai tare!..băi frate, numai proşti pe-aici.' În zadar personalul medical i-a spus doamnei Popescu ' Doamna!..băgaţi-l repede înapoi!! ..trageţi , trageţi!', ba chiar au încercat să-l împingă pe chel la loc, era prea târziu. CTP ieşise deja şi urla 'băi incapabililor pe mine să mă puneţi în prosop Frottierex, nu în căcatu' ăsta aspru'   	ctp, tudor popescu, moasa, nastere
https://neurococi.ro/posts/Noua-griblura-din-Mamaia-le-ajunge-masli/	Noua criblură din Mamaia le ajunge măslinilor sălbatici până la ţâţe.	      Dacă te-ai născut în România ţi-e clar că nici dacă ajungea lăţimea plajelor la 5 milimetri autorităţile nu ar fi mişcat altceva decât gura. Foarte bizar cum s-a luat decizia lăudată de toată, dar toată, presa să se lărgească plajele din Mamaia (în special în nord spre portul Midia-Năvodari) unde erau plaje plictisitor de late, cu nisip fin alb şi pâlcuri de măslini sălbatici. Peste tot acest întins de nisip alb s-a pompat din larg încă o plajă de nisip dur şi gri cu scoici cât palma, dar afânat ca să te afunzi până la glezne, astfel încăt în sezoanele viitoare (vreo 10.000 de ani) va trebui să-ţi pui în bagaj, pe lângă costumul de baie şi o pereche de cizme de cauciuc. De pe faleză nu se mai vede marea şi dacă 'privaţii' nu aduc repede nişte cămile să transporte turiştii spre apă nu cred că mai ajungem să facem o baie. Eroziunea există într-adevăr în zona de sud mai ales unde e coasta înaltă, de exemplu la Costinesti unde a şi dispărut o mare parte de plajă, nu în zona Mamaia unde e un echilibru natural de jdemii de ani. Presa a sesizat acum doar foca de pe vârful icebergului fără să vadă sau să scrie despre problemele reale. Au văzut numa că 'neşte patroni ticăloşi' au birturile pe cale să fie îngropate în nisip şi au fost chemaţi să discute despre rezolvare. Ce rezolvare? Discuţia o să fie cam aşa: 'buna ziua, staţi jos! În 2 săptămâni să vă strangeţi catrafusele că noi turnăm nisip pe afacerea voastră.'Logic, nu? Când afli că executantul lucrării este o firmă oladeză te luminezi, iar dacă eşti puţin conspiraţionist ai loc să dezvolţi ce vrei tu. Hai să încercăm: Noi zicem că lucrarea e făcută special ca ajutor pentru ca firma olandeză să nu ţină vaporu pe avarii în portul din Rotterdam pentru că, nu-i aşa, nu toată ziua faci un palmier de 6 kmp în Dubai. Dacă nu ne luăm pastilele, am putea adauga că e posibil ca olandezii să ştie că ce pun acum pe plajă ajunge în câţiva ani pe fundul apei la intrarea în port făcându-l nenavigabil pentru vasele mari. Dar asta e prea de tot. Se ştie doar că olandejii ie pretini şi n-au nici un interes la Marea Neagra. Ziceam la început că autorităţile nu mişcă decât gura. Asta în cel mai bun caz, pentru că varianta 2 e să mişte ritmic din cur în timp ce noi stăm cu gura căscată. p.s. dragă Putin, pentru faza cu olandejii ţi-am tăiat chitanţă pe 2 ruble   	largire plaje, mamaia, nisip, griblura, olanda, port, vapor, patroni, birturi, maslin sălb
https://neurococi.ro/posts/In-Miercurea-Ciuc-se-va-putea-fuma-in-sp/	În Miercurea Ciuc se va putea fuma în spaţiile inchise.	      Un grup de turişti veniţi din Alaska a fost găsit îngheţat în faţa unui bar din Miercurea-Ciuc. Un salvator ISU ne relatează de sub un strat gros de blănuri aranjate ingenios sub formă de căciulă: 'Când am ajuns în faţa barului am găsit un bloc compact de gheaţă prin care se zăreau turiştii imprudenţi cu ţigările în gură stinse pe la jumate. Trebuie făcut ceva, nu e prima dată când turişti naivi ieşiţi afară la ţigară îngheaţă, majoritatea în timp ce scutură bricheta. În Miercurea Ciuc noi ieşim afară numai în 15 august la prânz să spargem ţurţurii care încep să picure, să nu cumva să cadă şi să rănească pe cineva, chit că ultimul ţurţure a căzut în vara lui 1856 când un miercuriciucan îşi urca ţigla pe casă folosindu-se de un scripete batut în cuie pe ţurţurele defect.' Pentru a nu se repeta astfel de tragedii Consiliul Local a votat în unanimitate ridicarea interdicţiei de a fuma în spaţiile închise din Miercurea Ciuc. Deşi decizia este ilegală, consilierii nu-şi fac probleme: 'Dacă cineva de la Bucureşti este împotrivă, să vină să ne amendeze, că-i punem lângă ceilalţi turişti în depozit, probabil la rece.'   	eschimos, ciuc, rece, frig, fumat
https://neurococi.ro/posts/Raluca-Turcan-este-imuna-la-coronavirus/	Raluca Turcan este imună la coronavirus.	      Norocul ei că în clasele primare lua constant bătaie la jocul 'Spânzurătoarea', singura pe care a reuşit să o învingă vreodată fiind tovarăşa ei de giumbuşlucuri, Alina Gorghiu. (nota: Cum în Groapa Marianelor nu a fost semnalat încă nici un coronavirus, experţii au exclus-o din start pe Alina Gorghiu ca potenţială gazdă pentru SARS-CoV-2.) Gândurile noastre se îndreaptă îngrijorate către câştigatorul tuturor olimpiadelor de 'Spânzurătoarea', campionul absolut, Petre Roman.    	turcan, gat, petre, roman, gorghiu, coronavirus, sars-cov2, rapel, sfoara, mariane
https://neurococi.ro/posts/Liliecii-care-au-blocat-A1-daca-nu-erati	Liliecii care au blocat A1: dacă nu eraţi bulangii, vă dădeam noi SARS-CoV-2.	      Cei 10 lilieci, care au blocat timp de 3 ani realizarea autostrăzii Lugoj-Deva nu sunt încă mulţumiţi pe deplin. 'Păi dacă nu vă căcaţi pe voi să ne mutaţi într-o peşteră confort redus, după ce am muncit o viaţă să renovăm peştera de domiciliu, vă lăsam noi să luaţi covid din China? Vă dădeam bă ţăranilor, trebuia numa' să cereţi. Da' voi batman, batman. V-aţi zgârcit şi ne-aţi mutat într-o peşteră ANL unde nici nu avem de ce să ne atârnăm ca să stăm cu capu-n jos! Păi voi ştiţi ce nasol e să te pişi acum în somn?...să stai cu cracii-n pişat?..păi ce sunt io, Tudor Chirilă?'   	liliac, lugoj, deva, autostrada, pestera, pipi, covid-19
https://neurococi.ro/posts/Clujenii-vor-intra-in-prima-faza-in-Star/	Clujenii vor intra în primă fază în 'Stare de Pripeală'.	      Pentru a nu bulversa clujenii, aceştia vor intra treptat în starea de urgenţă. După calculele oamenilor de ştiinţă, unui clujean din trei i-ar putea puşca o venă dacă cineva l-ar trece brusc în stare de urgenţă. Specialiştii spun că sunt necesare cel puţin 4 stări intermediare, aşa că începând de astăzi, Clujul intră în 'Stare de Pripeală'. Se aşteaptă ca până Joi aceştia să afle noul statut. După câteva zile de acomodare se va comunica Starea de Sorgoşeală, apoi tot pe rând, Stările de Iuţeală şi de Zorire şi, în final, Starea de Urgenţă astfel încât, până la 1 Mai Clujul să fie pregătit.   	cluj, pripeala, urgenta, stare, covid, clujean, sorogoseala, specialisti
https://neurococi.ro/posts/Mesaje-cifrate-lasate-de-spioni-rusi-pe-/	Mesaje cifrate lăsate de spioni ruşi pe site-ul imminvest.ro.	      În buna tradiţie a site-urilor lansate de autorităţi, site-ul imminvest.ro, nu poate fi accesat datorită unor atacuri venite, bineinţeles, de pe nişte ip-uri ruseşti. Hackerii ruşi au lăsat mesaje bizare formate din grupuri de câte 3 cifre cum ar fi 503, 504 sau 508 însoţite de şiruri de caractere misterioase. Specialiştii guvernului au descifrat deja câteva şiruri de caractere aranjate ingenios astfel încât să formeze cuvinte în limba engleză, o tehnică des întâlnită în cazul atacurilor hackerilor ruşi în încercările lor naive de a-i păcăli pe IT-iştii români. Şeful diviziei de securitate cibernetică a dozatoarelor de cafea din sediul guvernului declară pentru Neurococi: 'Unul dintre mesaje este '503 Service Unavailable'. Pentru un ochi neexperimentat acest mesaj nu înseamnă nimic, dar pentru noi mesajul e clar: site-ul nu merge pentru că a fost spart de ruşi. Colegii de la STS au preluat iniţial cazul şi au încercat să scrie în address bar 'service unavailable' de 503 ori dar evident ca nu au rezolvat nimic..ei sunt mai comici aşa...acum am preluat noi şi nu ne lăsăm până nu rezolvăm. Am calculat ca trebuie să apăsăm tasta 'backspace' de 9557 de ori (19x503) ca să aducem sistemul la starea iniţială, apoi vom scrie corect, cu underscore, codul introdus greşit de papagalii de la STS. Suntem mult mai bine pregătiţi decât sovieticii, avem chiar şi un băiat care a făcut facultatea la Cluj, care ştie toate şmecheriile şi a scos cablul la monitor astfel încât să-i ţinem pe ruşi in beznă.'   	imminvest.ro, guvern, site, 503, ruşi, hackeri, spioni, it
https://neurococi.ro/posts/Adriana-Bahmuteanu-a-fost-rapita-de-o-fa/	Adriana Bahmuţeanu a fost răpită de o farfurie.	      Nu e vina ei că arată aşa proastă. Micuţa Adriana a început să fie răpită de farfurii incă de când a împlinit 19 kile. Deşi toţi dintre noi am sperat că într-o bună zi o va răpi şi o farfurie zburătoare, iată acest lucru nu s-a întâmplat, Adriana ajungând astfel să fie cea mai proastă răpită persoană din toate timpurile. Nu se ştie exact la ce experimente este supusă pe farfurie dar după fiecare răpire apare cu maioneză pe colţul gurii, semn că extratereştii i-au dat şi ei ceva de mâncare, exact aşa cum i-am da şi noi.   	bahmuţeanu, adriana, farfurie, zburatoare, extraterestii, area, 51, maioneza
https://neurococi.ro/posts/Satul-de-ruta-Simeria-Calan-un-tren-a-pl/	Sătul de ruta Simeria-Călan un tren a plecat la Bucureşti să se facă tramvai.	      Locomotivele din triajul Simeria sunt foarte mândre de tânărul tren cu un vagon care are aşa gânduri mari. 'Îl ştiu de când era uite-atâtica, noi ii spuneam Ceferest Gump că avea ceva probleme la roţi şi-l luau la mişto toate drezinele. Dar băiatu' ăsta a avut o ambiţie de invidiat şi a ajuns să fie cel mai rapid tren din depou. Cei 11 km pănă la Călan îi făcea în 34 minute. Am auzit că deja are barbă şi plete şi tot mai multe trenuri din ţară îl urmează. Acu' ce să zicem, noi îi ţinem pumnii şi sperăm ca până-n aprilie ajunge. Run, Ceferest, run!'   	cfr, gump, forrest, tramvai, bucuresti, locomotive, simeria, calan
https://neurococi.ro/posts/La-institutul-Mina-Minovici-a-mai-fost-d/	La institutul Mina Minovici a mai fost descoperit un borcan.	      Borcanul de aspirină zăcea uitat într-un dosar cu şină şi conţine penisul şi testiculele faimosului bandit clujean Babeş-Bolyai. Pe organul ascuns vederii cel puţin până acum se poate citi mesajul 'UB' care, în opinia experţilor de la o universitate clujeană înseamnă 'Universitatea Babeş-Bolyai E Cea Mai Tare Asta E Clar Şi O Spun Apăsat. Cluj Napoca Vă Dă Cioc!' * Nota Redacţiei: Contrar credinţei populare, celebrul bandit nu are nici o legatură cu Victor Babeş sau cu János Bolyai, care erau oameni respectabili şi nu-şi ţineau puţele-n borcan.   	Cluj, UBB, babes bolyai, penis, terente
https://neurococi.ro/posts/Mii-de-romani-au-inceput-pregatirile-pen/	Mii de români au început pregătirile pentru poza de Revelion	      Românii stau in aceste zile in fata calculatorului pentru a pregati poza pe care o vor posta in noaptea de Revelion. Reteta e simplă: Screensaverul preferat este ales, de regula, ca decor după care se ornează cu gagici si sticle de Jack Daniel's după gust   	revelion, romani, poza
https://neurococi.ro/posts/Socant-Andrei-Caramitru-dezvaluie-ca-e-v/	Şocant! Andrei Caramitru dezvăluie ca e votant PSD.	      Într-o postare pe facebook, cunoscutul fiu, Andrei Caramitru, dezvăluie că, deşi este membru USR, el votează PSD. Ca să nu fie nici un dubiu el descrie profilul votantului PSD: 'prost de bubuie care nu știe sa facă nimic şi e şi leneş!' adică exact profilul domniei sale, practic singurele caracteristici genetice necesare şi suficiente pentru a-i reconstitui prezenţa prin injectarea acestora într-un bou.   	caramitru, andrei, psd, prost, bubuie, lenes, nimic, usr
https://neurococi.ro/posts/Dupa-comunicatul-Mediafax-tarile-arabe-a/	După comunicatul Mediafax, ţările arabe au dat pe reverse pompele de petrol.	      Reacţie rapidă a arabilor care, la nici 2 ore de la comunicatul Mediafax potrivit căruia preţul barilului a scăzut sub 0 dolari, au acţionat comutatorul prin care pompele bagă înapoi în sol ţiţeiul pe care ar fi trebuit altfel să îl plătească la momentul vânzării. Sultanul Mediafaxului declară pentru neurococi.ro: 'Nu butut stat cu mâinile-n zîn. Imediat abăsat buton. Avut discuţ cu americanii care să vândă la noi înapoi betrol cu -1 dolar be baril ji îl băgăm ji pe ăla napoi la bământ. Dubă ce terminăm ne abucăm de altgeva, blantăm sparanghel vedem noi'   	mediafax, petrol, pret, baril, sultan, americani, sparanghel
